site,top,ecs,ecs_len,es,es_len,mfe,pvalue,ecs_unpair,ecs_pair,es_pair,es_unpair
Top:73|chr10_118406873|Rank:128|Level:0.0785,73,chr10_118407701_118408024_AluSx_Alu_+|chr10_118406873_+|ECS:CUA,324,chr10_118406754_118407057_AluSx1_Alu_-|chr10_118406873_+|ECS:CUA,304,-404.1,0.0,C   UA G     GCUU   A    AUAAA    C   AAA G    AGG            A C  C        C                                G C       CC                 ACAAA               A           CACA   AUAAUCCCAGCU                            A U       U  A         C                     AA                     CA      G       G    AA       A      GAAG     G   G   , GCU  G ACAGU    GGC CAUA     CUGU AUU   U AGGA   UUGGGAGGCUGA G GG UGGAUCAU UGAGGUCAGGAGUUCGAGACC    UGGCCAA A GGUGAAA  CUGUCUCUACUAAGAAU     GAAAAAAUUAGC GG GCAUGGUGGUG    CCU            ACUCGGGAGGCUGA  GGCAGGAGAAUC C UGAA CC GG AGGCGGAGG     UGCAGUGAGCCGAGGUC  GCUACUGCACUCCAGCUUGGG  GCAGAG GAGACUC GUCU  AAAAAAA AAAGAA    AAAAA AAG    , CGG  C UGUCA    CCG GUGU     GACA UAG   G UCCU   AACCCUCCGGCU C CC ACCUAGUG ACUCCAGUCCUCAAGUUCUGG    ACCGGUU U CCACUUU  GACAGAGAUGAUUUUUA     UUUUUUUAAUCG CC CGUACCACCAC    GGA            UGAGCCCUUCGACU  CCGUCCUCUU*G G ACUU GG CC UCCGCCUCC     ACGUCACUCGGCUCUAG  CGGUGACGUGAGGUCGGACCC  UGUCUC CUCUGAG UAGG  UUUUUUU UUUUUU    UUUUU UUU    ,C   CC G            A    G        U       G    CA             C A  C        A                     UCGG       G A       A                                   A              CUAC                             GU            C C    C  U            AACGU                 CG                     AC      G       G    GG       A      A        G   AUUU
Top:74|chr19_56151087|Rank:129|Level:0.077,74,chr19_56150078_56150379_AluSx_Alu_+|chr19_56151087_+|ECS:CUA,302,chr19_56150997_56151276_AluSx_Alu_-|chr19_56151087_+|ECS:CUA,280,-420.2,0.0,G             AC                   G            A                         G        G                      G       C    A       UUGUUAU   UUAUAUAAUAC      G      A    AUA      A                   G  AA          A C            U              A   U  A    C       C   U                 CA     CCA   C       A, GUGUGGUGGCUCA  CCUGUAAUCCCAGCACUUU GGAGGCUGAGGC GGUGGAUCACCUGAGGUCAGGAGUU GAGACCAG  UGGCUAAUAUGGUGAAAC CU UCUCUAC AAAA UAUAAAA       AUU           AGCUGG CGUGGU GUGC   CCUGUA UCUCAGCUAUUUGGGAGGU GA  CAGGAGAAUC C UGAGCCCGGGAG UGGAGGUUGCAGUG GCC AG AUUG GCCACUG ACU UAGCCUGGGCAACAGAG  AGACU   UCU CAAAAAA , CGUGCCACCGAGU  GGACAUUGGGGUCGUGAAA CCUCCGGUUCCG CCGCCUAGUGGACUCCAGUCCUCAA CUCUGGUC  ACCGGUUGUACCACUUUG GG AGAGAUG UUUU AUGUUUU       UAA           UCGGCC GCAUCA CACG   GGAUGU AGGGUCGAUGAACCCUCCG CU  GUCCUCUU*G G ACUUGGGUCCUC ACCUCCAACGUCAC CGG UC UAGC CGGUGAU UGA GUCGGACCCGUUGUCUC  UCUGA   AGA GUUUUUU ,              GU                   G            C                         G        GG                  A  A       A    C                                  G      C    AGG      C                   A  CC          C A            C              A   U       A       A   C                 CC     C              
Top:74|chr19_56151087|Rank:129|Level:0.077,74,chr19_56150481_56150820_AluJb_Alu_+|chr19_56151087_+|ECS:CUA,340,chr19_56150997_56151276_AluSx_Alu_-|chr19_56151087_+|ECS:CUA,280,-309.3,2e-06,   A        U  G  AGG    AUGUU     CCUA    A  C    AAU  GUAGAGACAUUUU     GUCACA               A     UG UACU   AUCUGGUGGGUGGA           A  CU    AACA                C     G    CCCACAACAAAGAGU  U   GCUCAAAAUGU     G     ACG                        A    A    A      A    U            U    C       A     AAG A        C   C    G            U     UC            U,    GG GGUUC CA CU   AGCC     GC CU    GAGG CA GGGC   GU             GGGUU      ACUUGGGGUUGGGGG   GGG  C    GCC              GGCCAA   GG UG  GCUC    CUCUAC    AGUGCA AGGAU GGCC               GG CCG           GUGGU GC CC   CCUGUAGUCCCAGCUGUUUGGGAG CUGA GUGG AGGAUC CUUG GCCUGGGAGG G GAGG UGCAGUG GCCAG   C UGCCACUG ACU CAGC UGGGCGACAGAG GAGAC  UGUCUCAAAAAA ,    CC CCGAG GU GA   UUGG     CG GA    CUCC GU UCCG   CG             CCUAG      UGGACUCCAGUCCUC   CUC  G    CGG              CCGGUU   CC AC  UGAG    GAGAUG    UCAUGU UUUUA UCGG               CC GGC           CACCA CG GG   GGAUGUCAGGGUCGAUGAACCCUC GACU CGUC UCUU*G GAAC UGGGUCCUCC C CUCC ACGUCAC CGGUU   G ACGGUGAU UGA GUCG ACCCGUUGUCUC CUCUG  ACAGAGUUUUUU ,CGUG  A     U  G  CA     GGU    U  AAGC    G       CC                                          AAG   UG U      A                   GUA     UU    GAA       AUUU            A                         AU                 A                             C    C    C      C    U          A      A       A     CUA C        A   C    G            C                    
Top:74|chr10_29749786|Rank:130|Level:0.077,74,chr10_29747747_29748028_AluJr_Alu_-|chr10_29749786_+|ECS:CUA,282,chr10_29749564_29749850_AluJo_Alu_+|chr10_29749786_+|ECS:CUA,287,-355.5,0.0,          A            A     CA     CUA                      C                             U       AG            C           A   A                      CCAG             A    UCCUUUUCC      UUUUUUUUUUUUGUA  GACU    C       ACUG     G       CA         C       G                                             A    C  ,           UUUUUUGAGACA GGUCU  CUCUG   CUCAGGCUGGAGUGCAGUGGUG AAUCAUAGCUCACUGCAGCCUCCAGCUCC GGGCUCA  UGAUCCUCCUGC UCAGCCUCCUG GUA CUGGGACUAUGAGUAUGCAUCA    GCCUGGCUAAUUU UUUU         AUUUUU               GA    GGGU UUGCUAU    CUUAG CUGGUCU  AACUUCUGG CUCAAGC AU             CCUC C    UGCUGGGAUUACAGGUGUGA CCAC   ,           AAAAAACUCUGU CCAGA  GAGAC   GGGUCCGACCUCACGUCACCAC UU*GUGUCGAGUGACGUCGGAGGUCGAGG UCCGAGU  GUUAGGAGGGUG AGUCGGAGGGU CAU GACCCUGAUGUUCGUGUGUGGU    CGGACCGAUUAAA AAAA         UAAAAG               UU    UCCA AACGGUA    GAGUC GACCAGA  UUGAGGACU GAGUUCG UA             GGAG G    ACGACCCUAAUGUUCGUACU GGUG   ,AAAACAAAAAC            C     AC     AAC                      A                                     CU            U           C   C                      AUUA             C    CA                              AC      A       CAGA     A       AC         C       G  GACGGGUGGAGUC    A UUUC                    C    ACG
Top:74|chr11_114165152|Rank:131|Level:0.077,74,chr11_114166147_114166451_AluY_Alu_-|chr11_114165152_+|ECS:CUA,305,chr11_114164923_114165216_AluSx_Alu_+|chr11_114165152_+|ECS:CUA,294,-478.8,0.0,U                   GACA                                       C                 G  C    C CC      AU  C                                           C     C  A          U         UUUUU                      C      A      A      C  U     G CCUC   A      C     A                           A      U C  C  C    U, UUUUUUUUUUUUUUUUUGA    GAGUCUUGCUCUGUCGCCCAGGCUGGAGUGCAGUGGCGC AUCUUGGCUCACUGCAA CU CGCC C  GGGUUC  GC AUUCUCCUGCCUCAGCCUCCCAAGUAGCUGGGACUGCAGGUGC UACCA CA GCCCAGCUAA UUUUUGUAU     UUUUAGUAGAGACGGGGUUUCA CAUGUU GCCAGG UGGUCU GA CUCCU A    GUG UCUGCC GCCUU GCCUCCCAAAGUGCUGGGAUUACAGGC UGAGCC C GC CC GGCC , AAAAAAAAAAAAAAAAACU    CUCAGAGUGAGACAGUGGGUCCGACCUCACGUCACUGCG U*GAGUCGAGUGACGUU GA GUGG G  CCCAAG  CG UAAGAGGACGGAGUCGGAGGGUUCGUCGACCCUGAUGUCCACG GUGGU GU CGGGUCGAUU AAAAACAUA     AAAAUCAUCUCUGCCCCAAAGU GUAUAA CGGUCC ACCAGA CU GAGGA U    CAC AGGCGG UGGAG CGGAGGGUUUCACGACCCUAAUGUCCG ACUCGG G CG GG CCGG ,                    ACAC                                       C                 G  A    A AA      GU  C                                           U     A  G                                               A      C      G      A  U     G C      A      A     C                           C      U A  C  A     
Top:74|chr17_29290863|Rank:132|Level:0.077,74,chr17_29289317_29289450_AluSc5_Alu_-|chr17_29290863_+|ECS:CCA,134,chr17_29290852_29290977_AluJr_Alu_+|chr17_29290863_+|ECS:CCA,126,-165.3,0.0,A         UUUUU  U    A         UCACC      G     A                A             A   A    C     C                 C            C    C      U, UUUUUGGUA     AG AGAU  UGAG GUU     AUGUUG CCAGG UGGUCUUGAAUUCUUG CCUCA  UGAUCC CCC  CUU GGCCU CCAAAGUGCUGGGAUUA AGGCAUGAGCCA CGCG CUGGCC , AAAAACCAU     UC UCUA  ACUU CGA     UACGAC GGUCC ACCAGAGUUUGAGGAC GGAGU  ACUAGG GGG  GAA CCGGA GGUUUCACGACCCUAAU UCUGUACUCGGU GUGU GACCGG ,          C      U    GA    G              A     G                C     UC      A   AA                           A            *    A       
Top:74|chr17_29290863|Rank:132|Level:0.077,74,chr17_29291876_29292002_AluSx_Alu_-|chr17_29290863_+|ECS:UUA,127,chr17_29290852_29290977_AluJr_Alu_+|chr17_29290863_+|ECS:UUA,126,-174.6,0.0,A     A       UG      C             G                                    G    C  C      U    A           CAA       G      UC      C, UUUUU GUAGAGA  AGGUUU   AC C AUGUUG CCAGGCUGGUCUUGAACUCCUGGCCUCAGGUGAUCC UCCU CU GGCCUC CAAA UGCUGGGAUUA   GCAUGAG CAUUGC  CUGGCU , AAAAA CAUCUCU  UCUAGA   UG G UACGAC GGUCCGACCAGAGUUUGAGGACCGGAGUUCACUAGG GGGA GA CCGGAG GUUU ACGACCCUAAU   UGUACUC GU*GUG  GACCGG ,      C               ACU  C A      A                                    A    A  A           C           AUC       G      UA       
Top:74|chr19_39983954|Rank:133|Level:0.077,74,chr19_39982324_39982487_AluJb_Alu_+|chr19_39983954_+|ECS:CUA,164,chr19_39983894_39984043_AluSx_Alu_-|chr19_39983954_+|ECS:CUA,150,-206.2,0.0, A   UAU    A                 G  A   G           G     C        A       CGU   U  C   GA   U   U      G     AA                  GAGC     C              AAA          A,  GGU   GCAU CCUGUAGUCCCAGCUAC UG GAG CUGAGGUGGGA GAAUC CUUGAGCC AGGAGGU   GCG GG UGU  UGA CUG GAUCGU CCGCU  AUUCUAGCCUGGGCAACA    GAGAC CUGUCUCAAAAAAA   AAAAAAAAAA ,  CCG   UGUG GGACAUUAGGGUCGAUG AC CUC GACUCCGUCCU CUUAG GAACUUGG UCCUCCA   CGU CC ACG  ACU GGC CU*GCG GGUGA  UGAGGUCGGACCCGUUGU    CUCUG GGUAGAGUUUUUUU   UUUUUUUUUU ,CA          C                 A  C   G                 U        G             C      UC   C   U      G     CG                           A              G             
Top:74|chr19_39983954|Rank:133|Level:0.077,74,chr19_39983374_39983544_AluSx1_Alu_+|chr19_39983954_+|ECS:CUA,171,chr19_39983894_39984043_AluSx_Alu_-|chr19_39983954_+|ECS:CUA,150,-252.8,0.0,G      G                           G                 A  A                A  U                 A A                            UAAG          CAAAAAAAAAAAAAA                  C, GUGGUG GUGCCUGUAAUCCCAGCUACUUGGGAG CUGAGGCAGGAGAAUCG UU AACCCAGGAG  GCAG GG UGCAGUGAGCUGAGAUC C CCAUUGCACUCCAGCCUGGGCGACAGAG    GCUCUGUCUC               AAAAAAACAAAAAAAAAA , CACCGU UGCGGACAUUAGGGUCGAUGAACCCUC GACUCCGUCCUCUUAGU AA UUGGGUCCUC  CGUC CC ACGUCACUCGGCUCU*G G GGUGACGUGAGGUCGGACCCGUUGUCUC    UGAGGUAGAG               UUUUUUUGUUUUUUUUUU ,       G                           G                 G  C          CA                         C G                                                                            
Top:74|chr19_39983954|Rank:133|Level:0.077,74,chr19_39985091_39985242_AluSx3_Alu_+|chr19_39983954_+|ECS:CUA,152,chr19_39983894_39984043_AluSx_Alu_-|chr19_39983954_+|ECS:CUA,150,-254.2,0.0,A      G                 C   C     G                                C G   U                   AA               CA       GAGU                     C      C  , GUGGUG GCGCCUGUAAUCCCAGU ACU  GGAG CUGAGGCAGGAGAAUCGCUUGAACCCAGGAGG G AGG UGCAGUGAGCCGAGAUCGC  CACUGCACUCCAGCC  GGUGACA    GAGACUCUGUCUCAAAAAAAC AAAAAA   , CACCGU UGCGGACAUUAGGGUCG UGA  CCUC GACUCCGUCCUCUUAGUGAACUUGGGUCCUCC C UCC ACGUCACUCGGCUCU*GCG  GUGACGUGAGGUCGG  CCGUUGU    CUCUGAGGUAGAGUUUUUUUG UUUUUU   ,       G                 A   AC    G                                A G   C                   GG               AC                                U      UUU
Top:74|chr11_108237953|Rank:134|Level:0.077,74,chr11_108236458_108236766_AluSq2_Alu_+|chr11_108237953_+|ECS:CUA,309,chr11_108237724_108238013_AluSc8_Alu_-|chr11_108237953_+|ECS:CUA,290,-461.5,0.0,G          A C                                       U A C       A        AGU         G      CAAGAGACCAGCC    CAGU          C         C                      A  A  G     G  A      A             A                   CU                GA     G U      CAAA                              A       A    CA     A       A, GGCUGGGCGC G GGCUCACGCCUGUAAUCCCAGCACUUUGGGAGGCCGAGG G G GGAUCAC AGGUCAGG   UCGAGACCA CCUGGC             UGGC    AUGGUGAAAC CUGUCUCUA UAAAAAUAC AAAAAUUAGCCG GC UG UGGCG GC CCUGUA UCCCAGCUACUCG GAGGCUGAGGCAGGAGAAU  CUUGAACCUGGGAGGU  AGGUU C GUGGGC    AUCAUGCCAUUGCACUCCAGCCUGGGUGAC AGAGCGA ACUC  UCUCA AAAAAAA , CCGGCCCGCG C CCGAGUGUGGACAUUAGGGUCGUGAAACCCUCCGGCUCC C C CCU*GUG UCCAGUUC   AGCUCUGGU GGACCG             AUUG    UGCCACUUUG GGCAGAGAU AUUUUUAUG UUUUUAAUCGGC CG AC ACCGU UG GGACAU AGGGUCGAUGAGC CUCCGACUCCGUCCUCUUA  GAACUUGGGUCCUCCG  UCCAA G CACUCG    UAGUACGGUGACGUGAGGUCGGACCCACUG UCUCGUU UGAG  AGAGU UUUUUUU ,           C A                                       U C A       C        GCU         A                                     A         U         U            C  C  A     G  C      C             C                   AC                UC     A U      ACUC                                      C    AC     C        
Top:75|chr2_27727945|Rank:135|Level:0.076,75,chr2_27727225_27727513_AluSq2_Alu_-|chr2_27727945_+|ECS:CUA,289,chr2_27727714_27728014_AluSx1_Alu_+|chr2_27727945_+|ECS:CUA,301,-485.1,0.0,     C                    C AAA        U                A    A    C         C                 C   U                            G G                                A                      AAU      A                             C                  G   C        C        A                            C        C,      UUUUUUUUUUUUUUUUGAGA G   UCUUGCUC UGUCACCCAGGCUGGA UGCA UGGC UGAUCUUGG UCACUGCAACCUCUGCU CCC AGUUCAAGCGAUUUUCCUGCCUCAGUCU C GAGUAGCUGGGAUUACAGGUGCCUGCCACCAC UCUGGCUAAUUUUUGUAUUUUU     AGAC        GCC UGUUGGCCAGGCUGGUCU GAACUCCUGACCUCAGGU AUC GCCCGCCU GGCCUCCC AAGUGCUGGGAUUACAGGCGUGAGCCAC GCACCCAG ,      AAAAAAAAAAAAAAAACUCU C   AGAGUGAG ACGGUGGGUCCGACCU ACGU ACCG GCU*GAACC AGUGACGUUGGAGAUGG GGG UUAAGUUCGCUAAGAGGACGGAGUCGGA G UUCAUCGACCCUAAUGUCCGUGGACGGUGGUG GGGCCGAUUAAAAACAUAAAAA     UCUG        UGG ACAAUCGGUUCGACCAGA CUUGAGGACUGGAGUUCA UAG CGGGCGGA CCGGAGGG UUUACGACCCUAAUGUCCGCACUCGGUG UGUGGGUC ,AAAAAA                    A CUC                         C    C    U         U                 A   U                            G G                                C                      CCAUC    CACCAAAG   U                  A                  G   A        A                                     A         
Top:76|chr11_8709240|Rank:136|Level:0.0745,76,chr11_8708667_8708954_AluSp_Alu_+|chr11_8709240_+|ECS:CUA,288,chr11_8709178_8709466_AluY_Alu_-|chr11_8709240_+|ECS:CUA,289,-339.2,1e-06,A     ACAAUUUUAAACAAA  UA    UUG       UC   U  UG             A AA UU   AAUA    CUC  C      G    A C   C   A                    UA    C          A           ACA        A            U          C                               G    U    G C                              A   A      A           CCCCCCC        A, GCUGG               UG  UCAU   GCUUGUA  UUC GU  U       GCUGG G  G  AGA    AGGG   UC AGACCA CCUG C AAC UGG GAAACCUUGUCUCUACUAAA    CA AAAAUUAGCC GGCGUGGUGGC   UGCCUGUA UCCCAGCUACUU GGAGGCUGAG CAGGAGAA   UCU   CC AGGAGGCGGAG UUGC GUGA C GAGAUCGUGCCAUUGCACUCCAGCUUGGGC ACA GAGUGA ACUCUGUC CA        CAAAAAA , CGGCC               AC  AGUA   CGGACAU  GGG CG  A       CGACU C  C  UCU    UCCU   AG UCUGGU GGAC G UUG GCC CUUUGGGACAGAGAUGAUUU    GU UUUUAAUCGG CCGCGUCACCG   GCGGACAU AGGGUCGAUGAA CCUUCGACUC GUCCUCUU   AGA   GG UCCUCCGCCUC AACG CACU G CUCU*GCGUGGUGACGUGAGGUCGGACCCG UGU CUCGCU UGAGGCAG GU        GUUUUUU ,C     CGCGCC           CG              UA   U  UG AACCCUC     C GC CG   AG      CU   C      A    C A   U   A                    UUAC  U          C           CCC        C            C          C        ACC   CUU  A           G    U    A A                              C          C        A  UUUGUUUU        
Top:77|chr7_99830827|Rank:137|Level:0.074,77,chr7_99829748_99830049_AluY_Alu_+|chr7_99830827_+|ECS:CUA,302,chr7_99830594_99830886_AluJo_Alu_-|chr7_99830827_+|ECS:CUA,293,-382.8,0.0, C                C  CUG  A  C                C    CA  U            G       A          CCUGGUUAACAC   AAA                        AAA        C            GG CG     A            C                  AACA CG   A        G  U  C             AG  C C        AC     C    GU        A      C     AA     A        A    A,  CGGGCGCAGUGGCUCA GC   UA UC CAGCACUUUGGGAGGC GAGG  GG GGAUCAC  GAG UCAGGAG UUGAGACCAU            GGU   ACCCCGUCUCUACUAAAAAA UAC   AAAUUAGC GGGCAUGGUGGU  G  CCUGU GUCCCAGCUACU GGGAGACUGAGGCAGGAG    G  UGA CCUGGGAG UG AG UUGCAGUGAGCUG  AU G GCCACUGC  UCUAG CUGG  GACAGAGC AGACUC GUCUC  AAAAA AAAAAAAA AAAA ,  GCCCGCGUCACCGAGU CG   AU AG GUUGUGAAACCCUCCG UUCC  CC CCU*GUG  CUC GGUCCUC AACUCUGGUA            UCA   UGGGGCAGAGAUGAUUUUUU AUG   UUUAAUUG CCUGUACUACCG  C  GGACA CAGGGUCGAUGG CUCUCUGGCUCCGUCCUC    C  ACU GGGUCCUC AC UC GACGUCACUCGAC  UA C UGGUGGCG  AGGUC GACC  CUGUCUCG UCUGAG UAGAG  UUUUU UUUUUUUU UUUU ,CA                A  AAA  C  A                A    AC  U       AA   G       A                         CUC                    A   AAA        A            UA AA     C            A                  CUAG AA   C        A  C  C             AA  A U        AA     C    UU        C      A     AA     A        A     
Top:77|chr7_99830827|Rank:137|Level:0.074,77,chr7_99830069_99830357_AluSx1_Alu_+|chr7_99830827_+|ECS:CUA,289,chr7_99830594_99830886_AluJo_Alu_-|chr7_99830827_+|ECS:CUA,293,-377.1,0.0, C A    A  C      C  CUG  A  C                         U       C    G         CU      GCCUGGCCAACAG     AU    A                  AG         CA            GG CA     AA                              A  G C    A        GC                CAA              AC     C     U               C                      C   ,  C GGCG GG GGCUCA GC   UA UC CAGCACUUUGGGAGGCUGAGGUGGG GGAUCAC UGAG UCAGGAGUU  AGACCA             GGUGA  CCCC UCUCUACUAAAAAA UAC   AAAUUAGC  GG UGUGGUGGU  G  CCUGU  UCCCAGCUACUUGGGAGGCUGAGGCAGGAG AU G UUGA CCUGGGAG  GGAGGUUGCAGUGAGC        GAUCACUGC  UCCAG CUGGA GACAGAGUGAGACUC AUCUC  AAA   AAAAAAAAU    ,  G CCGC UC CCGAGU CG   AU AG GUUGUGAAACCCUCCGAUUCCACCC CCU*GUG ACUC GGUCCUCAA  UCUGGU             UCACU  GGGG AGAGAUGAUUUUUU AUG   UUUAAUUG  CC GUACUACCG  C  GGACA  AGGGUCGAUGGACUCUCUGGCUCCGUCCUC UA C AACU GGGUCCUC  CCUCCGACGUCACUCG        UUGGUGGCG  AGGUC GACCU CUGUCUCGCUCUGAG UAGAG  UUU   UUUUUUUUA    ,CA C    G  A      A  AAA  C  A                         U       A    G         AC      A                 CU    C              A   AAA        A   U         UA AA     CC                              C  G A    C        AA                ACAAUAAC         AA     C     U               A     AA   UUA         UUUU
Top:77|chr20_30683964|Rank:138|Level:0.074,77,chr20_30684024_30684369_AluSg_Alu_+|chr20_30683964_+|ECS:AUA,346,chr20_30683661_30683987_AluSz_Alu_-|chr20_30683964_+|ECS:AUA,327,-502.5,0.0,G             A  C       A                  A   CA  C       A        GG                                                                             G    C             A  C                 G                    CA   G      CAA     C     U      U                 GA                       A   A   A   A   A         CUUGCUCUGUUGCCC  GCUGU      G       A , GGCACAGUGGCUC CA CUGUAAU CCAGCACUUUGGGAGGCC AGG  GG GGAUCAC   AGGUCA  AGUUUGAGACCAGCCUGGCCAAUAUGGUGAAACCCUGUCUCUACUAAAGAUACAAAAAUUAGCUGGGCGUGGUGGCA GUGC UGUAGUCCCAGCU CU GGGAGGCUGAGGCAGGA AAUCAUUUGAACCCGGGAGG  GAG UUGCAG   UGAGC GAGAU GUGCCA UGCACUCCAGCCUGGGU  UAGAGCGAGACUCCGUCUCAAAA AAA AAA AAA AAA AGAUAGGUG               AG     AGUGGA GGGUGAG  , CCGUGUCACCGAG GU GACAUU* GGUCGUGAAGCCCUCCGG UCC  CC CUUAGUG   UCCAGU  UCAAGCUCUGGUCGGACCGGUUGUACCACUUUGGGACAGAGAUGAUUUUUAUGUUUUUGAUCGACCCGUACUACCGU UACG ACAUUAGGGUCGA GA CCCUCCGACUCCGUCCU UUAGUGAAUUUGGGUCCUCC  CUC AACGUC   ACUCG CUCUA CGCGGU ACGUGAGGUCGGACCCG  GUCUCGCUCUGAGGCAGAGUUUU UUU UUU UUU UUU UUUAUUUAU               UU     UUAUUU UUUAUUU  ,              C  A       G                  G   AC  A       AAC      AG                                                                             G    A             C  A                 G                    AC   A              A     C      U                 UC                       A   A   A   A   A                          AU         A       AU
Top:77|chr20_30683964|Rank:138|Level:0.074,77,chr20_30685105_30685435_AluY_Alu_+|chr20_30683964_+|ECS:UUA,331,chr20_30683661_30683987_AluSz_Alu_-|chr20_30683964_+|ECS:UUA,327,-475.4,0.0,G      U      AU                              G       A                GG  A         U           C          CA                A          CA            G    ACC             A        A           G   G  GUG   G        C   AC                  A A   C                  AA           C          AC                           U     C    G       A , GGCACG UGGCUC  GC  CUGUAAUUCCAGCACUUUGGGAGGCU AGGUGGG GGAUCAC  GAGGUCA  AG UCGAGACCA CCUGGCUAACA GGUGAAACCC  UCUCUACUAAAAAUAC AAAAAUUAGC  GGCGUGGUGGCG   GC   UGUAGUCCCAGCU CUUGGGAG CUGAGGCAGGA AAU GC   AAA CCGGGAGG GGA  UUGCAGUGAGCUGAGAUG C CCA UGCACUCCAGCCUGGGCA  CAGAGCGAGAC CUGUCUCAAA  AUAAAUAAAUAAAUAAAUAAAUAAAUG AAUGA UAAA GAAUAAA  , CCGUGU ACCGAG  CG  GACAUU*GGGUCGUGAAGCCCUCCGG UCCACCC CUUAGUG  CUCCAGU  UC AGCUCUGGU GGACCGGUUGU CCACUUUGGG  AGAGAUGAUUUUUAUG UUUUUGAUCG  CCGUACUACCGU   CG   ACAUUAGGGUCGA GAACCCUC GACUCCGUCCU UUA UG   UUU GGUCCUCC CCU  AACGUCACUCGACUCUAC G GGU ACGUGAGGUCGGACCCGU  GUCUCGCUCUG GGCAGAGUUU  UAUUUAUUUAUUUAUUUAUUUAUUUAU UUAUU AUUU UUUAUUU  ,       C          UA                          G       A       AA       AG  A         C           A          AC                           AC            GUA  A               C        C           G   G  AA    G        A   CA                  C C   U                  C            A                                             U    A       AU
Top:77|chr16_84935464|Rank:139|Level:0.074,77,chr16_84935933_84936238_AluY_Alu_+|chr16_84935464_+|ECS:CUA,306,chr16_84935394_84935704_AluSx1_Alu_-|chr16_84935464_+|ECS:CUA,311,-455.4,0.0,A          A               A                   C     AG          A           CA         U C   CU    A              U            G                CA  C        U  ACA                  C                     G CA                              A                   A  G         C G  C             UC              C  C    U, GGCCGGGCGC GUGGCUCACGCCUGU AUUCCAGCACUUUGGGAGG CGAGG  GGUGGAUCGC   AGGUCAGGA  UCGAGACUA C UGG  AACA GGUGAAACCCCGUC CUACUAAAAAUA AAAA    AAAUUAGC  GG GUGGU GU GG   CUUGUAGUCCCAGCUACU GGGAGGCUGAGGCAGGAGAAU G  UGAACCCAGGAGGUGGAGGUUGCAGUGAGC GAGAUCACGCCACUGCACU CA CCUGGGUGA A AG GAGACUC  CAUC  AAAAAAAAAAGAAA AA AAAA , CCGGUCCGCG CACCGAGUGCGGACA UAGGGUCGUGAAACUCUCC GCUCC  CCGUCUAGUG   UCUAGUCCU  AGUUCUGGU G ACC  UUGU CCACUUUGGGGUAG GAUGGUUUUUAU UUUU    UUUAAUCG  CC CACCA CG CC   GGACAUUAGGGUCGAUGA CCCUCCGACUCCGUCCUCUUA U  ACUUGGGUCCUCCACCUCCAAUGUUGCUCG CUCU*GUGUGGUGACGUGA GU GGACCCGCU U UC CUCUGAG  GUAG  UUUUUUUUUUUUUU UU UUUU ,           C               G                   A     GG          AAC         CA         C U   C     A              C            G    UGUU        AC  A     U  U  AC                   A                     G AA                              G                   G  G         A G  A       AC    UU              U  U     
Top:77|chr16_84935464|Rank:139|Level:0.074,77,chr16_84936864_84937222_AluSg_Alu_+|chr16_84935464_+|ECS:CUA,359,chr16_84935394_84935704_AluSx1_Alu_-|chr16_84935464_+|ECS:CUA,311,-448.9,0.0, C      ACCCCCAACAUCG  ACU  CACAGAACAUUCC  AAAGUAUC    GAA      A                   C      A               C     C             CC  CCAA  GACCAGCCUGGCCA         C        U    A                                      CA                  G   A                     C              C  C                                    G       A      GGC          C      UUU                 C,  CCAGGU             GC   GU             GG        CUUA   GCCUGU AUCCCAGCACUUUGGGAGG CGAGGC GGCGGAUCA  UGAG UCAGG GUUUGAGACCAGC  GG    GA              AUAUGGUGA ACCCCAUC CUAC AAAAAUACAAAAAU      UAGCUGGGUGUGGUGGCG  UGCCUGUAAUUCCAGCUA UUG GAGGCUGAGGCAGGAGAAUCG UUGAACCUGGGAGG GG GGUUGCAAUGAGCCGAGAUCACACCGUUGCACUCCA CCUGGGC   ACAG   GAGACUCUGU UUAAAA   AAAAAAAAAAAAAAAAG ,  GGUCCG             CG   CA             CC        GAGU   CGGACA UAGGGUCGUGAAACUCUCC GCUCCG CCGUCUAGU  ACUC AGUCC CAAGUUCUGGUCG  CC    CU              UGUACCACU UGGGGUAG GAUG UUUUUAUGUUUUUG      AUCGACCCACACCAUCGU  ACGGACAUUAGGGUCGAU AAC CUCCGACUCCGUCCUCUUAGU AACUUGGGUCCUCC CC CCAAUGUUGCUCGGCUCU*GUGUGGUGACGUGAGGU GGACCCG   UGUC   CUCUGAGACG AGUUUU   UUUUUUUUUUUUUUUUU ,CC                     C                               G        G                   A      G         GA    U     U             UA                               U        C    G              UUUUUA                  CC                  G   C                     A              A  U                                    G       CUA    A            U      UU                  U
