site,top,ecs,ecs_len,es,es_len,mfe,pvalue,ecs_unpair,ecs_pair,es_pair,es_unpair
Top:1|chr1_26652533|Rank:1|Level:0.833,1,chr1_26651766_26652060_AluSx_Alu_+|chr1_26652533_-|ECS:CCA,295,chr1_26652401_26652682_AluJo_Alu_-|chr1_26652533_-|ECS:CCA,282,-406.7,0.0,A   A            A   CUA            G                U  G   UC         CAA   ACAU    C       A C   UCUCCUGCCUCAG               U     CA    UGU    C           AA                G   C   CA                G        AC            AC            A   G                  C            C       U            G, UUU UUUUUGAGAUGG GUC   CUCUGUCACCCA GCUGGAGUG CAGUGG GU AUC  GGCUCACUG   CCU    CUCC GGGUUCA G GAU             CCUCCCGAGUAGCUG GAUUA  GGCG   GCCA CACACCUGGCU   UUUUUUUGUAUUUUU GUA AGA  GGGUUUUGCCAUGUUG CCAGGCUG  CUCGAACUCCUG  CUCAGGUGAUCC CCC CCUUGGCCUCCCAAAGUG UGGGAUUACAGG GUGAGCC CCGCGCCCGGCC , AAA AAAAACUCUGUC CAG   GAGACAGUGGGU CGACCUCAU GUCACC CG UAG  CCGAGUGAC   GGA    GAGG CCCGAGU C CUA             GGAGGGCUCAUCGAC CUGAU  UCGU   CGGU GUGUGGAUCGA   AAGAAAACAUAAAAA CAU UCU  CCCAGAGCGGUACAAC GGUCCGAC  GAGCUUGAGGAC  GAGUUCGUUGGG GGG GGAGCCGGAGGGUUUCAC ACUUUAAUGUCC CACUCGG GGCGUGGGUCGG ,A   A            C   AGC            G         G      U  G   UA         AUC   GUUU    A       C A                               C     A     GUU    *           GUA               A   C   AC                G        CA            CC            A   A                  U            U       U             
Top:1|chr1_26652533|Rank:1|Level:0.833,1,chr1_26652746_26653042_AluY_Alu_+|chr1_26652533_-|ECS:CCA,297,chr1_26652401_26652682_AluJo_Alu_-|chr1_26652533_-|ECS:CCA,282,-391.4,0.0,U                 A    UCU              G  A             CA G   UC         CA      UGC    C       U CCAUUCUCC  CCUCAG                     CA     CC    C      C    AA                A                A       AG     A         U      AC    U       G   G    A             C    U       U          A         U, UUUUUUUUUUGAGACAG GUCU   UGCUCUGUCGCCCA GC GGAGUG CAGUGG  U AUC  GGCUCACUG  AG CUC   CUCC GGGUUCA G         UG      CCUCCUGAGUAGCUGGGACUA  GGCAC  GCCA CAUGCC GGCU   UUUUUUUGUAUUUUU GUAGAGAUGGGGUUUC CCAUGUU  CCAGG UGGUCUCGA CUCCUG  CUCA   GAUCC CCC UCUC GCCUCCCAAAGUG UGGG UUACAGG GUGAGCUACC UGCCCAGCC , AAAAAAAAAACUCUGUC CAGA   GCGAGACAGUGGGU CG CCUCAU GUCACC  G UAG  CCGAGUGAC  UC GAG   GAGG CCCGAGU C         AC      GGAGGGCUCAUCGACCCUGAU  UCGUG  CGGU GUGUGG UCGA   AAGAAAACAUAAAAA CAUCUCUACCCCAGAG GGUACAA  GGUCC ACCAGAGCU GAGGAC  GAGU   UUGGG GGG GGAG CGGAGGGUUUCAC ACUU AAUGUCC CACUCGGUGG GUGGGUCGG ,                  C                     G  A      G      UC G   UA         A   G   UUU    A       C            UA                         A      UU    *      A    GUA               A                C       CG     G         U      CC    UCG     A   A    C             U    U       U          C          
Top:2|chr16_83844369|Rank:2|Level:0.619,2,chr16_83843073_83843367_AluSp_Alu_-|chr16_83844369_+|ECS:GCA,295,chr16_83844159_83844430_AluSz_Alu_+|chr16_83844369_+|ECS:GCA,272,-388.8,0.0,U    U    U         C              U    G                A     CG   U      C      C     C       GG    AACGAUU  C     UCAGCCUCCC                    U                  C      GUAUUUUUA   G            U            U C         A     G  C    G                   A                                   C        C, UUUU UUUU UUUUUUUGA ACGGAGUUUUGCUC UGUU CCCAGGCUGGAGUGCA UGGCA  AUC CGGCUC CUGCAA CUUUG CCUCCUG  UUCA       GU CUGCC          GAGUAGCUGGGAUUACAGGC UGUGCCACCACACCCAGC AAUUUU         GUA AGACGGGGUUUC CCAUGUUGGUCA G UGGUCUCGA  UUCU AC UUGA UGAUUUGCCC   GCCU C    GCCUCUCAAAGUGCUGGGAUUACAGGUGUGAG CGCCGUGC , AAAA AAAA AAAAAAACU UGUCUCAGAACGAG ACAG GGGUCCGACCUCACGU ACCGU  UAG GCUGAG GACGUU GAGAC GGAGGAC  GAGU       CA GACGG          UUCAUCGACCCUAAUGUCCG ACGUGGUGGUGUGGGUCG UUAAAA         CAU UCUGUCCCAAAG GGUACAACCGGU C ACCAGAGCU  AGGA UG AGUU ACUAGACGGG   CGGA G    CGGAGGGUUUCACGACCCUAAUGUCCGUACUC GUGGUGCG ,     U    U         C                   A                C     *G   U      U      U             A                                                  C                  A      A           G            U            C A         CG    G  U    G          AGA    C GAAA                                A         
Top:3|chr14_103191979|Rank:3|Level:0.5065,3,chr14_103192383_103192686_AluSg_Alu_+|chr14_103191979_+|ECS:AUA,304,chr14_103191906_103192207_AluSz6_Alu_-|chr14_103191979_+|ECS:AUA,302,-401.4,0.0,G    G       G   C   A A                        C        CA      GAG                       C      CAU         CCGUC           UAC   A   A    G      A   AGG           G          A            GA               ACCCA    GC           C    C     A C                         A                     CCCUCCAA     AAA   A    U      , GGCU GGCGUGG GGC CAC C UGUAAUCCCAGCACUUUGGGAGGC GAGGCAGG  GAUCAC     GUCAGGAGUUCGAGACCAGCC GGCCAA   GGUGAAACC     UCUACUGAAGG   AAA AUU GCUG GCGUGG GGC   UGCCUGUAGUU CGGCUACUUG GAGGCUGAGGCA  GGAAUC    GCUUG     GGAG  GGAGGUUGCAG GAGC GAGAU G GCCACUGCACUCCA   GC CUGGG GACAGAGUGAGAC CUGUCUC        AAAAA   AAA GAAC       , CCGG CCGUGUC CCG GUG G ACAUUAGGGUCGUGAAACCCUCCG CUCCGUCC  CUAGUG     CAGUCCUUAAGCUCUGGUCGG CCGGUU   CCGUUUUGG     AGAUGACUUUU   UUU UAA CGGC CGCACC CCG   GUGGACAUCAG GUCGAUGAAC CUCCGACUCCGU  UCUUAG    CGAGC     CCUC  CCUCCGACGUC CUCG UUCU* C UGGUGACGUGAGGU   CG GACCC UUGUCUUGUUCUG GGCAGAG        UUUUU   UUU CUUG       ,     G       A   A   C G                        A        AC      AACUA                     A      UUU         AU              C     A   C    A      A   CGU           G          C            GC      UUCU              UA           A    A     G A              GAA  A     G             A                    GUG   A    UUUUUUU
Top:4|chr14_89039882|Rank:4|Level:0.488,4,chr14_89038072_89038334_AluSc5_Alu_+|chr14_89039882_+|ECS:CUA,263,chr14_89039770_89040021_AluSq2_Alu_-|chr14_89039882_+|ECS:CUA,252,-354.9,0.0,A       C            U     GA G       U        ACCA          U   C    CUA                            C     ACAUGCCU     C                 C GG                    A    UU            G   CC    A       C   C                     C        A         UAAAU       UA        A, AGGUGGG GGAUCAU GGGC CAGGA  U GAGACCA CUUGGCCA    ACAUGGUGAA CUC GUCU   CUAAAAAUAC AAAAAUUAGCCAGGCAU GUGGC        GUAAU CCAGCUACUUGGGAGGC G  GCAGGAGAAUCGCUUGAACC GGGA  UGGAGGUUGCAG GAG  GAGA CGCGCCA UGC CUCCAGCCU GGCGAC AGAG GAGACUCC UCUCAAAAA     AAAUAAA  AAAAUAAG , UCCACCC CCUAGUG CCCG GUCCU  A UUCUGGU GGACCGGU    UGUGCCACUU GGG CAGA   GAUUUUUAUG UUUUUAAUCGGUCCGUA CACCG        CAUUA GGUCGAUGAGCCCUCCG C  CGUCCUCUU*GCGAACUUGG UCCU  ACCUCCAACGUC CUC  CUCU GCGCGGU GUG GAGGUCGGA CCGUUG UCUC CUUUGAGG AGAGUUUUU     UUUAUUU  UUUUAUUU ,        A       U          AA G       C                      U   A    AAC          U                 C     CC           U                 A UU                    G    CC            A   AA    A       A   U         C      U    A        A         CAU         UA         
Top:4|chr14_89039882|Rank:4|Level:0.488,4,chr14_89039491_89039740_AluY_Alu_+|chr14_89039882_+|ECS:GUA,250,chr14_89039770_89040021_AluSq2_Alu_-|chr14_89039882_+|ECS:GUA,252,-386.3,0.0,G   C            A        GA         U                      C    CUA                                  A  CGCCU     C                               G  G             C    C     C    CCA           C                         C        G     ACCAA     A    A             , AGG GGGUGGAUCACG GGUCAGGA  UUGAGACCA CCUGGCUAACACGGUGAAACCC GUCU   CUAAAAAUACAAAAAAUUAGCCAGGCAUGGUGGC GG     GUAGU CCAGCUACUCGGGAGGCUGAGGCAGGAGAAU GC UGAACCUGGGAGG GGAG UUGCA UGAG   AGAUCGUGCCA UGCACUCCAGCCUGGGCAAC AGAG GAGACUCC UCUCA     AAAAG AAAA              , UCC CCCACCUAGUGU CCGGUCCU  AGUUCUGGU GGACCGGUUGUGCCACUUUGGG CAGA   GAUUUUUAUGUUUUUUAAUCGGUCCGUACCACCG CC     CAUUA GGUCGAUGAGCCCUCCGACUUCGUCCUCUU* CG ACUUGGGUCCUCC CCUC AACGU ACUC   UCUAGCGCGGU GUGUGAGGUCGGACCCGUUG UCUC CUUUGAGG AGAGU     UUUUC UUUU              ,    A            C        AA         C                      A    AAC                                               U                               G  A             A    C     C    AAC           A                    U    A        A               A    AUUUUAUUUUAUUU
Top:5|chr8_17358250|Rank:5|Level:0.435,5,chr8_17358539_17358698_AluSz6_Alu_-|chr8_17358250_+|ECS:CCA,160,chr8_17358141_17358298_AluSx_Alu_+|chr8_17358250_+|ECS:CCA,158,-272.0,0.0,U                  U A          A                C            C            G                  A         C                         UG        UG  C     C        A, UGAGACAGAGUCUCGUUC G CGCCCAGGCU GAGUGCAGUGGUGCGA CUUGGCUCACUG AACUUUCACCUC UGGGUUCAAGCAGUUCUC UGCCUCAGC UCCCGAGUAGCUGGGAUUACAGGCG  UGCCACCA  UU GGCUA UUUUUGUA , ACUCUGUCUCAGAGCGAG C GUGGGUCCGA CUCACGUCACCGUGCU GAGCCGAGUGGC UUGGAGGUGGAG GUCUAAGUUCGUUAAGAG ACGGAGUCG AGGGUUCGUCGACCCUAAUGUCCGU  ACGGUGGU  GG CCGAU AAAAACAU ,                   U A          C                *            U            G                  G         A                         GG        UU  A     U         
Top:6|chr2_27378928|Rank:6|Level:0.4155,6,chr2_27379247_27379554_AluY_Alu_-|chr2_27378928_+|ECS:GUA,308,chr2_27378910_27379209_AluSq2_Alu_+|chr2_27378928_+|ECS:GUA,300,-497.5,0.0,C         G      G    A    CUC        CA  G         C                                           U   C                           C       AC  C     CCC    A              UUUUUUUUUUU                                    A C    A         U                                                              G                 G, UUUUUUUUU UUUUUU AGAC GAGU   ACUC UGU  CC AGGCUGGAG GCAGUGGCGUGAUCUCGGCUCACUGCAAGCUCCGCCUCCUGGG UCA GCGAUUCUCCUGCCUCAGCCUCCCGAG AGCUGGG  UA AGGCA   GCCA CACGCCCGGCUAAU           UUUGUAUUUUUAGUAGAGACGGGGUUUCACCAUGUU G CAGG UGGUCUUGA CUCCUGACCUC  GUGAUCCGCCC   GCCUCGGCCUCCCAAAGUGCUGGGAUUACAGGCAU AGCCACCGCACCCGGCU , AAAAAAAAA AAAAAA UCUG CUCA   UGAG ACA  GG UCCGACCUC CGUUACCGUGUUAGAGUCGAGUGACGUUUGAGGUGGAGGACCC AGU CGUUAAGAGGACGGAGUCGGAGGGUUC UCGACCC  AU UCCGU   CGGU GUGUGGGUCGAUUA           AAGCAUAAAAAUCAUCUCUGUCCCAAAGUGGUACAA C GUCC ACCAGAACU GAGGACUGGAG  UACUAGGUGGG   UGGGGCCGGAGGGUUUCACGACCCUAAUGUCCGU* UCGGUGGUGUGGGUCGG ,          A           C    AAA    A   AC  G         A                                           U   U                           A       CA  A     ACA    G                                                             C A    G         U           UC           GGC                                   G                  
Top:7|chr19_53069483|Rank:7|Level:0.412,7,chr19_53068057_53068357_AluSx_Alu_+|chr19_53069483_+|ECS:AUA,301,chr19_53069416_53069718_AluSq2_Alu_-|chr19_53069483_+|ECS:AUA,303,-405.2,0.0,A   AG   GCGA    U  C          C                C        C                    A         U           C          C          AC             G    A    CU        GGG    A     CC       C   A        CA        GG    AAC             UCUUG      G       A      C                        G                        U         U, GGC  GGU    UGGC CA ACCUGUAAUC CAGCACUUUGGGAGGC GAGGCGGG GGAUCAC  GAGGUCGGGAG UUGAGACCA CCUGGCUAACA GGUGAAACCC GUCUCUACUA  AAUACAAAA AAU AGCC GGCG  GUG  GCA   GCCU UAGUC  AGCUACU GGG G GCUGAG  GGGAGAAU  CGUG   CCU GGAGGCAGA     CAGUGA CCGAGAU GCACCA UGCACUCUGGCCUGGGCGA AAGA UGAGACUCCGUCUCAAAAAAUAAA   AAAUAAA , CCG  UCG    ACCG GU UGGACAUUAG GUCGUGAAACCCUCCG CUCCGUCC CCUAGUG  CUCCAGUCCUU AGUUCUGGU GGACUGAUUGU UUACUUUGGG CAGAGAUGAU  UUAUGUUUU UUA UCGG CCGU  CAC  CGU   CGGA AUUAG  UCGAUGA CCC C CGACUC  UCCUCUUA  GCAU   GGA CCUCCGUCU     GUCACU GGCUCU* CGUGGU ACGUGAGGUCGGACCCGUU UUCU ACUUUGAGGCAGAGUUUUUUGUUU   UUUGUUU ,    GG   UAUC    C  A          A                A        A       GA           A         C           A          U                     C   A    C    AC   UA   A      C     AC       A     A      UG        G     CAU   C         CCAAA      A       G      A                   G    A                        UGU        
Top:7|chr19_53069483|Rank:7|Level:0.412,7,chr19_53068057_53068357_AluYk4_Alu_+|chr19_53069483_+|ECS:AUA,301,chr19_53069416_53069718_AluSq2_Alu_-|chr19_53069483_+|ECS:AUA,303,-405.2,0.0,A   AG   GCGA    U  C          C                C        C                    A         U           C          C          AC             G    A    CU        GGG    A     CC       C   A        CA        GG    AAC             UCUUG      G       A      C                        G                        U         U, GGC  GGU    UGGC CA ACCUGUAAUC CAGCACUUUGGGAGGC GAGGCGGG GGAUCAC  GAGGUCGGGAG UUGAGACCA CCUGGCUAACA GGUGAAACCC GUCUCUACUA  AAUACAAAA AAU AGCC GGCG  GUG  GCA   GCCU UAGUC  AGCUACU GGG G GCUGAG  GGGAGAAU  CGUG   CCU GGAGGCAGA     CAGUGA CCGAGAU GCACCA UGCACUCUGGCCUGGGCGA AAGA UGAGACUCCGUCUCAAAAAAUAAA   AAAUAAA , CCG  UCG    ACCG GU UGGACAUUAG GUCGUGAAACCCUCCG CUCCGUCC CCUAGUG  CUCCAGUCCUU AGUUCUGGU GGACUGAUUGU UUACUUUGGG CAGAGAUGAU  UUAUGUUUU UUA UCGG CCGU  CAC  CGU   CGGA AUUAG  UCGAUGA CCC C CGACUC  UCCUCUUA  GCAU   GGA CCUCCGUCU     GUCACU GGCUCU* CGUGGU ACGUGAGGUCGGACCCGUU UUCU ACUUUGAGGCAGAGUUUUUUGUUU   UUUGUUU ,    GG   UAUC    C  A          A                A        A       GA           A         C           A          U                     C   A    C    AC   UA   A      C     AC       A     A      UG        G     CAU   C         CCAAA      A       G      A                   G    A                        UGU        
Top:7|chr19_53069483|Rank:7|Level:0.412,7,chr19_53071342_53071650_AluSx_Alu_+|chr19_53069483_+|ECS:CUA,309,chr19_53069416_53069718_AluSq2_Alu_-|chr19_53069483_+|ECS:CUA,303,-433.1,0.0,U    A      CA   U  G          C       C                 C           C          A  A           C      GG       C           AA        CC                 GC   C       U   C           A                     CUU A   CA   C        CG      G        A     C                        GCA    G  U  C   AAC                  A, GGCC GGCAUG  GGC CA GCCUGUAAUC CAGCACU UGGGAGGCUGAGGCGGG GGAUCGCCUGA GUCAGGAAUU GA ACCAGCCUGGC AACAUG  GAAACCC GUCUCUACUGA  AUACAAAG  AUUAGCCGGGCAUGGUG  GCA GCCUGUA UUU AGCUAUUUGGG G GCUGAGGCAGGAGAA CUG   G ACC  GGA GUGGAGGU  UAGUGA CCGAGAUC CAUCA UGCAUUCCAGCCUGGGCGAC AGA   GGAC CC UC CAA   AAAACAAAACAAAACAAA , CCGG UCGUAU  CCG GU UGGACAUUAG GUCGUGA ACCCUCCGACUCCGUCC CCUAGUGGACU CAGUCCUUAA UU UGGUCGGACUG UUGUAU  CUUUGGG CAGAGAUGAUU  UAUGUUUU  UAAUCGGCCCGUACCAC  CGU CGGACAU AGA UCGAUGAACCC C CGACUCUGUCCUCUU GGC   C UGG  CCU CGUCUCCA  GUCACU GGCUCU*G GUGGU ACGUGAGGUCGGACCCGUUG UCU   UUUG GG AG GUU   UUUUGUUUUGUUUUGUUU ,     G      CA   C  A          A       A                 A           C          G  C           A      UA       U                     CU                 UA   A       U   C             A               A   AU  A   AC   C        AA      A        C     A                    U   AAC    A  C  A                         
Top:8|chr12_50595634|Rank:8|Level:0.407,8,chr12_50593986_50594282_AluSx_Alu_-|chr12_50595634_-|ECS:---,297,chr12_50595400_50595712_AluSq_Alu_+|chr12_50595634_-|ECS:---,313,-485.4,0.0,G     CA                                     G      A        A                            A  CC   G       C  CA                             G      G         C           C    C         U                  UCC                                                       C        CA                A    U             A        , CUGGG  CAGUGGCUCACGCCUGUAAUCCCAGCACUUUGGGAGG UGAGGC GGUGGAUC CCUGAGGUCAGGAGUUCGAGACCAGCCU GC  ACA GGUGAAA CC  UCUCUACUAAAAAUAUAAAA    AGCCG GUGUGG GGUGCAUGC UGUAAUCCCAG UGCU GGGAGGCUG GGCAGGAGAAUCGCUUGA   CA GGAGGUGGAGGUUGCAGUGAGCUGAG    UG CACUGCACUCCAGCCUGGG GAC AGAG  AGACUCUGUCUCAAAA UAAA AAAUAAAAUAAAA         , GACCC  GUCACCGAGUGCGGACAUUAGGGUCGUGAAACCCUUC ACUCCG CCACCUAG GGACUCCAGUCCUCAAGUUCUGGUCGGA CG  UGU CCACUUU GG  AGAGAUGAUUUUUAUGUUUU    UCGGU CACACC CCACGUGUG ACAUUAGGGUC AUGA CCCUCCGAC CCGUCCUCUUAGCGAACU   GU CCUCCGUCUCCAACGUCACUCGGCUC    GC GUGACGUGAGGUCGGACCC UUG UCUC  UUUGAGGUAGAGUUUU AUUU UUUAUUUUAUUUU         ,      AC                                     G      C        C                            C  CU   A       A  AC                    UUAA     G      A         A           A    A         U                  UA   C                          U*GU  G                   C   U    AC                     U             AUUUUAUUU
Top:8|chr12_50595634|Rank:8|Level:0.407,8,chr12_50596785_50597092_AluSz_Alu_-|chr12_50595634_-|ECS:CUA,308,chr12_50595400_50595712_AluSq_Alu_+|chr12_50595634_-|ECS:CUA,313,-463.2,0.0,  A  C      A      A            A           C                A     A             A           C               C                  AAAA            G    A    CA     C           C    A                      A      CCUA    A        A                 A                    U                          A       A    AAG     U       ,   GG GCAG G GCUCAC CC GUAAUCCCA CACUUUGGGAG CUGAGGUGGGUGGGUC UUUGA GUCAGGAGUUCAG ACCAGCCUGGC AACAUGGUGAAAUCC GUCUCUACUAAAAAUACA    AAAAAUUAGCCA GUGU GUGG  CACAC UGUAAUCCCAG UACU GGGAGGCUGAGGCAGGAGAAUC CUUGAA    GGAG UGGAGGUU CAGUGAGCUGAGAUCAC CCACUGUACUCCAGCCUGGG GACAGG GUGAGACUCCAUCUCAAAA AAAAAAA AAAA   GAAGU        ,   CC CGUC C CGAGUG GG CAUUAGGGU GUGAAACCCUU GACUCCGCCCACCUAG GGACU CAGUCCUCAAGUU UGGUCGGACCG UUGUACCACUUUAGG CAGAGAUGAUUUUUAUGU    UUUUUAAUCGGU CACA CACC  GUGUG ACAUUAGGGUC AUGA CCCUCCGACUCCGUCCUCUUAG GAACUU    CCUC GUCUCCAA GUCACUCGGCUCU*GUG GGUGACGUGAGGUCGGACCC UUGUUC CACUUUGAGGUAGAGUUUU UUUUUUU UUUU   UUUUA        ,GAC  A    A        C  A         C           C                C     C             C           C               A                                  G    C    AC     A           A    A                      C      AGUC    C        C                 C                    C      U                   A       A    A       UUUUAUUU
Top:8|chr12_50595634|Rank:8|Level:0.407,8,chr12_50597174_50597494_AluSx1_Alu_-|chr12_50595634_-|ECS:UUA,321,chr12_50595400_50595712_AluSq_Alu_+|chr12_50595634_-|ECS:UUA,313,-482.5,0.0,G        GA        A                          C        CA                                    U            C  CA                             GCA       CAG                  C                              G   CC                        G A             A              C    C   CA            C    A       A     UGGUAUUC      C      G, CUGGGUGU  UGGCUCAC CCUGUAAUCCCAGCACUUUGGGAGGC GAGGUGGG  GAUUGCCUGAGGUCAGGAGUUCAAGACCAGCUUGGC AACGUGGUGAAA CC  UCUCUACUAAAAAUACAAAAA UUAGCCA    UGGUGG   GCAC C UGUAAUCCCAG UACUUGGGAGGCUGAGGCAGGAGAAUCGCU GAA  CA GGAGGCAGAGGUUGCAGUGAG C AGAUUGCGCCACU CACUCCAGCCUGGG GACA  AG  AGACUCCGUCUC AGGA AAAAAAA AAGAU        AAAAUA AAUGGA , GACCCACG  ACCGAGUG GGACAUUAGGGUCGUGAAACCCUUCG CUCCGCCC  CUAGCGGACUCCAGUCCUCAAGUUCUGGUCGGACCG UUGUACCACUUU GG  AGAGAUGAUUUUUAUGUUUUU AAUCGGU    ACCACC   CGUG G ACAUUAGGGUC AUGAACCCUCCGACUCCGUCCUCUUAGCGA CUU  GU CCUCCGUCUCCAACGUCACUC G UCU*GUGCGGUGA GUGAGGUCGGACCC UUGU  UC  UUUGAGGUAGAG UUUU UUUUUUU UUUUA        UUUUAU UUAUUU ,         UC        C                          A        AC                                    C            A  AC                     U       GCAC      A      U A           A                              A   A   C                     G C             C              C    UC  AC                 A       A                   U       
Top:9|chr10_37599143|Rank:9|Level:0.3645,9,chr10_37600762_37601068_AluSx3_Alu_-|chr10_37599143_+|ECS:CCC,307,chr10_37599100_37599393_AluSx1_Alu_+|chr10_37599143_+|ECS:CCC,294,-390.7,0.0,A    G    G    G     A     CAC      UU                 AUG  C           G         U   CA            U  AG        C                                    ACACUAAA UU    A          U            CA                     AC       CA                          U C     CC      CUA             A          GUGACCU  UG  UUC    A, UUUU UUUU UUUU AGAUG AGUUU   GCU  G  GCUUGGGCUGGAGUGCA   GC UGAUCUCAGCU ACUGCAACC CUG  UUCC GGGUUCA GC  UUCUCCUG UUCAGCCUCCCAAGUAGCUGGGAUUACAGGUGUUCA        C  GGCU AUUUUUUGUA UUUUAGUAGAGA  GGGUUUCACUAUGUUGGCCAG  UGG UCU  AACUCCUGACCU  GGUGAUCUGCCC C UUGGC  CCCAAA   CUGGGAUUACAGG GUGAGCCACU       GC  CC   GGUC , AAAG AAAA AAAA UCUAC UCAGA   CGA  C  CGGGUCCGACCUUACGU   CG GCUAGAGUCGA UGACGUUGG GGC  GAGG CCCAAGU CG  GAGAGGGU GAGUCGGAGGGUUCAUCGACCCUAAUGUCCACGGGU        G  CCGA UGAAAAACAU AAAAUCAUCUCU  CCCAAAGUGGUACAACCGGUC  GCC AGA  UUGAGGACUGGA  CCAUUAGGUGGG G AGUCG  GGGUUU   GAUCCUAAUGUCC CACUCGGUGG       UG  GG   UCGG ,     G    A          C     C     GU GG                 CAA  U           G         U   A     A       U  CU        A                                    AAUAGUAC GG                            AC                     C    A   AC            GU            U A     U*      CAC             G                   UG          
Top:10|chr11_66028132|Rank:10|Level:0.364,10,chr11_66028108_66028559_AluJb_Alu_+|chr11_66028132_+|ECS:GCA,452,chr11_66028071_66028365_AluSg_Alu_-|chr11_66028132_+|ECS:GCA,295,-345.3,0.0, C      UG AGUAUA     ACGAUCUCAGC    UGCAGCCUCU    CUCAGGUUCAA        CCU  CUCA  C  CU   UA       ACU     CA    CCACCACACCCAGCU AUUUUUGUAUUUUU   AGAGAU                G        G     CUU  AAUCCU        GAUCUGUCCGC   A   UCCU     GCUAGGAUUACAG   UGAGCCACCGUGCCU GCCAAAAAAUUUUUU        CAGC            CA  C                            G  A    C             A                      U  CG       AGCC        CA                AU         UUAAAAAAAAAA              G,  CCAGGC  G      GUGGC           UCAC          GCCU           GUGAUUCU   GC    GC UC  GAG  GCUG GG   ACAGG  CGCG               A              GGU      GGGGUUUC   ACCAU UUGGCCAG AUGGU   GA      GACCUCGU           CUC GCC    GAAGU             GCG               G               AAAUUAGC    UGUGGUGGUGUG  CC GUAGUCCCAGUUACUCAGGAGGCUGAGG GG AGGA CACUUGAGCCUGG AGGUAGAGGCUGCAGUGAGCUG GA  GUGCCAU    CUUCGGCC  GGUGACAGAGUGAGAC  UGUCUUAAA            AAAAAAAAGAGAGA ,  GGUCCG  C      CACCG           AGUG          CGGA           CAUUAGGA   CG    UG AG  CUC  CGAC CC   UGUCU  GUGC               U              CCA      UCCUAAAG   UGGUA GACCGGUU UACCA   CU      UUGGGGUA           GAG UGG    UUUUA             UGU               U               UUUAAUCG    ACACCACCGCGC  GG CAUCAGGGUCGAUGAGUCCUCCGACUCC UC UCUU GUGAACUUGGACU UCCGUCUCCGACGUCACUCGAC CU  CACGGUG    GAGGUCGG  CCGUUGUCUCGUUCUG  ACAGAGUUU            UUUUUUUUCUUUUU ,CC      UG                                                            U          A  UC         U  GCC     A                                      G             UUC     G        G                                      A   U                                                               ACCC            AC  A                            G  C    A             C                      U  *G       AUAU        AC                                                      
Top:11|chr3_188600755|Rank:11|Level:0.360,11,chr3_188598671_188598942_AluYk4_Alu_+|chr3_188600755_+|ECS:CUA,272,chr3_188600528_188600782_AluYc_Alu_-|chr3_188600755_+|ECS:CUA,255,-475.7,0.0, U             A        C                          AUCCUGGCUAAC                          AAAAAAAAAAA                CU   U A          C                  A                                             U              A           G              A                      A         A  ,  GCUUUGGGAGGCC AGGCGGGC GAUCACGAGGUCAGGAGAUCGAGACC            ACGGUGAAACCCCGUCUCUACUAAAA           UACA  AAAAAUUAGC  GGC C GUGGCGGGCG CUGUAGUCCCAGCUACUC GGAGGCUGAGGCAGGAGAAUGGCGUGAACCCGGGAAGCGGAGCUU CAGUGAGCCGAGAU GCGCCACUGCA UCCGGCCUGGGCGA AGAGCGAGACUCCGUCUCAAAA AAAAAAAAA   ,  UGAAACCCUCCGG UCCGCCCG CU*GUGCUCCAGUCCUCUAGCUCUGG            UGCCACUUUGGGGCAGAGAUGAUUUU           AUGU  UUUUUAAUCG  CCG G CACCGCCCGC GACAUCAGGGUCGAUGAG CCUCCGACUCCGUCCUCUUACCGCACUUGGGCUCUUCGCCUCGAA GUCACUCGGCUCUA CGCGGUGACGU AGGUCGGACCCGCU UCUCGUUCUGAGGCAGAGUUUU UUUUUUUUU   ,CG             C        C                                                                C              UU          AC   C C          A                  C                                             C              A           G              G                      C         CUU
Top:11|chr3_188600755|Rank:11|Level:0.360,11,chr3_188601270_188601535_AluSc_Alu_+|chr3_188600755_+|ECS:CUA,266,chr3_188600528_188600782_AluYc_Alu_-|chr3_188600755_+|ECS:CUA,255,-454.3,0.0,A                     A                A             UCCUGGUCAACA             A           AAAA                C       U         C           A                           CA C       A      A   G           A                                    A                  A         A  , GCACUUUGGGAGGCCGAGGCG GCGGAUCAUGAGGUCA GAGAUCGAGACCA            UGGUGAAACCCCG CUCUACUAAAA    UACA   AAAAUUAGC GGGCGUG UGGCGGGCG CUGUAGUCCCA CUACUUGGGAGGCUGAGGCAGGAGAAU  C UGAACCC GGAGGC GAG UUGCAGUGAGC GAGAUUGCGCCACUGCACUCCAGCCUGGGCGACAGA CGAGACUCCGUCUCAAAA AAAAAAAAA   , CGUGAAACCCUCCGGCUCCGC CGCCU*GUGCUCCAGU CUCUAGCUCUGGU            GCCACUUUGGGGC GAGAUGAUUUU    AUGU   UUUUAAUCG CCCGCGC ACCGCCCGC GACAUCAGGGU GAUGAGCCCUCCGACUCCGUCCUCUUA  G ACUUGGG UCUUCG CUC AACGUCACUCG CUCUAACGCGGUGACGUGAGGUCGGACCCGCUGUCU GUUCUGAGGCAGAGUUUU UUUUUUUUU   ,                      C                C                                      A           C       UUU         A       C         A           C                           CC C       C      C   G           G                                    C                  C         CUU
