site,top,ecs,ecs_len,es,es_len,mfe,pvalue,ecs_unpair,ecs_pair,es_pair,es_unpair
Top:43|chr17_17114307|Rank:50|Level:0.1375,43,chr17_17113305_17113606_AluSx1_Alu_-|chr17_17114307_-|ECS:CUA,302,chr17_17114248_17114545_AluSc5_Alu_+|chr17_17114307_-|ECS:CUA,298,-468.1,0.0,  A  CA  U         A   G    C                  A               CU         U            C                 C                                A  C      U  G C              C     A            AGGA    C               G     G                 G  C    G     C U    G      AA                         A       C     C,   GG   C GUGGCUCAC CCU UAAU CCAGCACUUUGGGAGGCC AGGUGGGCGGAUCAC  GAGGUCAGG GUUCGAGACCAG CUGGCCAACAUGGUGAA UCCCAUCUCUACUAAAAGUACAAAAAUUAGCU GG GUGGUG CA G ACCUGUAAUCCCAG UGCUC GGAGGCUGAGGC    GAAU GCUUGAACCAGGGAG UGGAG UUGCAGUGAGCUGAGAU GC CCAU GCACU C GUCU GGCAGC  AGCGAGACUCUGUCUCAAAAAAUAA AAAUAAA ACAAA ,   CC   G CACCGAGUG GGA AUUA GGUCGUGAAAUCCUCCGG UCCGCCCGCCU*GUG  CUCCAGUCC CAAGCUCUGGUC GACCGGUUGUACUACUU GGGGUAGAGAUGAUUUUUAUGUUUUUAAUCGG CC CACCAC GU C UGGACAUUAGGGUC AUGAG CCUCCGACUCCG    CUUA CGAACUUGGUCCCUC GCCUC AACGUCACUCGGCUCUA UG GGUG CGUGA G CGGA CCGUUG  UCGUUCUGAGACAGAGUUUUUUGUU UUUGUUU UGUUU ,CGA  CAC C         G   G    A                  C                          U            A                 U                                C  A      C  A A              A     C            A       A               A     G                 G  U    A     U U           CC                                 U     U
Top:43|chr17_17114307|Rank:50|Level:0.1375,43,chr17_17115132_17115435_AluSc8_Alu_-|chr17_17114307_-|ECS:CUA,304,chr17_17114248_17114545_AluSc5_Alu_+|chr17_17114307_-|ECS:CUA,298,-447.2,0.0,A  C   C  A         G   G    C                       A                     A    C    UC          C               G            A           A  CA     A  GA               C     A   A        A   GAAUCA        C     G A   G            A                  C      G      A           CA                     UAC   U , GC GGG GC GUGGCUCAU CCU UAAU UCAGCACUUUGGGAGGCUGAGGC GGCGGAUCACGAGGUCAGGAG UCGA ACCA  CUGGCUAAUA GGUGAAACCCUGUCU UACUAAAAAUAU AAAAAUUAGCC GG  UGGUG CA  UGCCUGUAGUCCCAG UACUC GGA GCUGAGGC GGA      CUUGAACC GGGAG C GAG UUGCAGUGAGCC AGAUCACACCACUGCACU CAGCCU GGCAAC GAGUGAGACUC  UCUCAAAAAACA AAACAAAA   CAG  , CG CCC CG CACCGAGUG GGA AUUA GGUCGUGAAAUCCUCCGGCUCCG CCGCCU*GUGCUCCAGUCCUC AGCU UGGU  GACCGGUUGU CUACUUUGGGGUAGA AUGAUUUUUAUG UUUUUAAUCGG CC  ACCAC GU  AUGGACAUUAGGGUC AUGAG CCU CGACUCCG CUU      GAACUUGG CCCUC G CUC AACGUCACUCGG UCUAGUGUGGUGACGUGA GUCGGA CCGUUG CUCGUUCUGAG  AGAGUUUUUUGU UUUGUUUU   GUU  ,   A   A  C         G   G    A                       C                     A    C    CA          A               G                        C  AC     C  AC               A     C   C        A   AAC           U     A C   G            C                  U             C           AC            U        U     UU
Top:44|chr17_25641756|Rank:51|Level:0.1365,44,chr17_25639725_25640083_AluSx_Alu_+|chr17_25641756_+|ECS:CUA,359,chr17_25641680_25641991_AluSx3_Alu_-|chr17_25641756_+|ECS:CUA,312,-409.8,0.0,A    CAAUA    UA  U UG      AGUG AA  AAAUUUUAA         CACUGAGUUAGAU   AAAUACUGACUUA   AAGUUGAAUUG    A      CAAA    CU        C             C     A    U A      C      CUA            AAAAAAA          CA          U     ACA               A                                                      A          A               A     ACA    A C        A            A       U             , GCCA       UG  UC U  CUGUAA    C  GG         AUUCUGGGA             GGU             CGA           GGUG GGCGGG    UCAC  GAGGUCAG AGUUUGAGACUAG CUGGC AACA G UGAAAC CUGUCU   CUAAAAAUACAA       AAAAAUUAGC  GGCGUGGUGG    GC   CCUGUAGUCCUAGCU CUUGGGAGGCUGAGGCAGGAGAAUUGCUUGAACCCAGGAGGUGGAGGUUGCAGU AGCCAAGAUC CACCACUGCACUCCA CCUGG   ACAG G GAGACUCC UCUCAAAAAAAA AAAAAAU              , CGGU       AC  AG G  GAUAUU    G  UC         UGAGACCCU             CCG             GCU           CCGC CCGCCU    AGUG  CUCCAGUC UCAAACUCUGGUC GACCG UUGU C ACUUUG GGCAGA   GAUUUUUAUGUU       UUUUUAAUCG  CCGCACCACC    CG   GGACAUUAGGGUCGA GAACCCUCCGACUCCGUCCUCUUAACGAACUUGGGUCCUCCACCUCCGACGUCA UCGGUUCU*G GUGGUGACGUGAGGU GGGUC   UGUC C CUCUGAGG AGAGUUUUUUUU UUUUUUA              ,C    CCAAGCC  CG  U UG      A    GG  G                                                                                         C             A     G             C      CAG            G                AC          CCCU  C                 C                                                      C          C               C     CAC    A A        C            A       UUUUUUAUUUUUUU
Top:44|chr17_25641756|Rank:51|Level:0.1365,44,chr17_25641318_25641609_AluSx1_Alu_+|chr17_25641756_+|ECS:CUA,292,chr17_25641680_25641991_AluSx3_Alu_-|chr17_25641756_+|ECS:CUA,312,-434.7,0.0,U       CG A     C                               A    A          UUA   C        CAU   A  C   A     AU                  U   CU     U                   A      U   UU        C        A   A             A                      AAA                        A   A                        A  A                U        U                , GGCCGGG  C GUGGC CACACCUAUAAUCCCAGCACUUUGGGAGGCC AGGC GGUGGGUCAC   AGG CGGGAGUU   GAC AG CUG CCAAC  AGUGAAAC CC  CUGUC CUA  AAAAU   ACAAAAAUUAGCUGGGC UGGUGG GGG    CCUGUA UCCUAGCU CUU GGAGGCUGAGGCA GAGAAUUGCUUGAACU  GGAG   UGGAGGUUGCAGUGAGCUGAGAUC CGC ACUGCACUCCAGCCUGGGUGACAG GU AGACUCU      AAA AAAUAAGA                 , CCGGUCC  G CACCG GUGUGGAUAUUAGGGUCGUGAGACCCUCCGG UCCG CCGCCUAGUG   UCC GUCCUCAA   CUG UC GAC GGUUG  UCACUUUG GG  GACAG GAU  UUUUA   UGUUUUUAAUCGACCCG ACCACC CCC    GGACAU AGGGUCGA GAA CCUCCGACUCCGU CUCUUAACGAACUUGG  CCUC   ACCUCCGACGUCACUCGGUUCU*G GUG UGACGUGAGGUCGGGUCCACUGUC CA UCUGAGG      UUU UUUAUUUU                 ,        AA C     A                               C    C          C     A        ACU   G  A   C               C  CA                UGU                 C          UCGC      U        C   C             C                GU    C                          C   G                        A  C       CAGAGU   U        UUAUUUUUUAUUUUUUU
Top:45|chr22_19009914|Rank:52|Level:0.136,45,chr22_19009476_19009780_AluY_Alu_+|chr22_19009914_+|ECS:CUA,305,chr22_19009853_19010148_AluSz_Alu_-|chr22_19009914_+|ECS:CUA,296,-459.8,0.0,G       G          A                                CA       C  AA           AUC     CAU                 A    C  C           AAAAAAAAAAAAA      G      GC       C GG                   U        U A           G     UC    CA      A   C                     A                           C                  A         U, GCUGGGC CGGUGGCUCA GCCUGUAAUCCCAGCACUUUGGGAGGCUGAGG  GGCAGAU AC    GGUCAGGAG   GAGAC   CCUGGCUAACAUGGUGA AUCC GU UCUACUAAAAA             AAAAAU AGCCAG  GUGGUGG G  UGCCUGUAGUCCCAGCUAC CAGGAGGC G GGCAGG GAAU G  UG  AACC  GGAGGC GAG UUGCAGUGAGCCGAGAUCGAG CACUGCACUCCAGCCUGGGCGACAGAG GAGACUCUGUCUCAAAAA AAAAAAAAA , CGACCCG GCCACCGAGU CGGAUAUUAGGGUUGUGAAACCCUCCGACUUC  CCGUCUA UG    CCGGUCCUC   CUCUG   GGACCGGUUGUACCACU UGGG CA AGAUGAUUUUU             UUUUUA UCGGUC  CACCACC C  GUGGACAUUAGGGUCGAUG GUCCUCCG C CUGUCC CUUA U  AC  UUGG  CCUCCG CUC AACGUCACUCGGUUCU*GCUC GUGACGUGAGGUCGGACCCGCUGUCUC CUCUGAGACAGAGUUUUU UUUUUUUUU ,        A          G                                AC       A  AACG         AAC     AUC                 C    A  C           AUG                A      UA       A GU                   U        U C      U    G GA        AC      C   C                     G                           A                  C          
Top:45|chr22_19009914|Rank:52|Level:0.136,45,chr22_19011551_19011929_AluSc5_Alu_+|chr22_19009914_+|ECS:GUA,379,chr22_19009853_19010148_AluSz_Alu_-|chr22_19009914_+|ECS:GUA,296,-366.9,0.0, G   A G  CAUCCCCA      GGUGA G                 A       ACCCCAGCCCA     C      A   GGA     CC  A    CCCCUGUAU         GUGUCCC   AGGC    CUC       CCC  CAGCA      C UGCGGACCCUCUUUA   CCC    UUAAA      AUUCAGU      UGACAC        CA       AG        A             U        U A                     A     U G                      G C                                     C       AAAAAAAAA             A,  UGG G UC        GGUGGU     G GC    AAUCCUGACAC     GAG           GCUGG AG GGG AGG      GC  CC AGGA         GUUGG GGC       GCC    GGCC   CAUGGUG   AG     GCCCUG U               GUC   ACUG     AAAAUA       GAAAAU      UAGCUGGG  UGGUGGU  GU  GCCU UAAUCCCAGCUAC CGGGAGGC G GACGGGAGAAUCGCUUGAACC GGGAG C GGAGGUUGCAGUGAGCCGAGAU G GCCACUGCACUCCAGCCUGGGUGACAGAGUGAGACUC GUCUCAA         AAAGAAAAAAGGA ,  ACC C AG        CCACCG     U CG    UUAGGGUUGUG     CUC           CGACU UC CCC UCU      CG  GG UCCU         CAACC CUG       CGG    CCGG   GUACCAC   UC     UGGGAC A               CAG   UGAU     UUUUAU       UUUUUA      AUCGGUCU  ACCACCA  CG  UGGA AUUAGGGUCGAUG GUCCUCCG C CUGUCCUCUUAGUGAACUUGG CCCUC G CCUCCAACGUCACUCGGUUCU* C CGGUGACGUGAGGUCGGACCCGCUGUCUCACUCUGAG CAGAGUU         UUUCUUUUUUUUU ,CG     G                AG    G  GAUA           AAACC                      A   G   AAUGAA  CC                     U   AU        A       UU                                            A                 G                          AC           UG    C             U        U C                     A     C                        G U                                     A                              
Top:45|chr19_10172029|Rank:53|Level:0.136,45,chr19_10169873_10170147_AluSx1_Alu_+|chr19_10172029_+|ECS:CUA,275,chr19_10171806_10172089_AluSq2_Alu_-|chr19_10172029_+|ECS:CUA,284,-434.7,0.0,A    U  A  A C                 C   U         A                    CUU         C    A  A       C                C    C           U                C                                                             G  A      CA               CA    CACA   C    C    C                   C        , GGCU GG GC G GGCUCACGCCUGUAAUC CAG ACUUUGGGA GCCGAGGCAGGUGGAUCACC   GGUCAGGAG UCGA AC AGCCUGG CAACAUGGUGAAACCU GUCU UAUUAAAAAUG   AAAAAUUAGCUGGG GUGGUGGUGGGUGCCUGUAAUCCCAGCUACUUGGGAGGCUGAGGCAGGAGAAUCGCUUGAA CC  GGAGG  GAGGUUGCAGUGAGC  AGAU    CCA UGCA UCCA CCUGGGUGACAGAGGGAGG         , CCGA CC CG C CCGAGUGUGGACAUUAG GUC UGAAACCCU CGGUUCCGUCCGCCU*GUGG   CCAGUCCUC AGCU UG UCGGACC GUUGUACCACUUUGGG CAGA AUGAUUUUUAU   UUUUUAAUCGGUCC CACCACCACCCACGGACAUUAGGGUCGAUGAGUCCUCUGACUCCGUCCUCUUAGUGAACUU GG  CCUCC  CUCCAACGUCACUCG  UCUA    GGU ACGU AGGU GGACCUACUGUUUUUUUUU         ,     C  G  C A                 A   U         C                    ACU         A    C  G       A                A    C           GUU              A                                                                AC     AC               AC    ACAC   A    C    C                   UUUUUUUUU
Top:45|chr19_10172029|Rank:53|Level:0.136,45,chr19_10170283_10170582_AluJr_Alu_+|chr19_10172029_+|ECS:UUA,300,chr19_10171806_10172089_AluSq2_Alu_-|chr19_10172029_+|ECS:UUA,284,-362.3,0.0,U   A      A                  C   CU          U     A    A     U       C      C         A     G      A         CA   A  AA      UU                            C CA                G A                             U  A AA  CCA    C            U   CAUC   C    C           CAAUA   C    CUCUGUCUCUAUU         U    A, GCU GGUGUG UGGCUCAUGCCUGUAAUC CAG  AC UUGGGAG CUGAG CAGG GGAUU CUUGAGG CAGGAG UCGAGACCA UCUGG CAACAU GUGAGACCC  UCU UA  AAAAGU  GCA     AUUAGCUGGGUGUGGUGGUG G  CCUGUAGUCCCAGCUA U GGGAGGCUGAGGCAGGAGGAUCACUUGAG CC G  AG    AGG UGCAGUGAGCUG GAU    CCA UGCA UCCAGCCUGGG     GAC AAGA             AAAAAAAAA AAAA , CGA CCGCGC ACCGAGUGUGGACAUUAG GUC  UG AACCCUC GGUUC GUCC CCU*G GGACUCC GUCCUC AGCUCUGGU GGACC GUUGUA CACUUUGGG  AGA AU  UUUUUA  UGU     UAAUCGGUCCACACCACCAC C  GGACAUUAGGGUCGAU A UCCUCUGACUCCGUCCUCUUAGUGAACUU GG C  UC    UCC ACGUCACUCGAC CUA    GGU ACGU AGGUCGGACCU     CUG UUUU             UUUUUUUUU UUUU ,C   C      C                  A   U   A       C     C    G     U       A      A         C     A      C         AC   C  GA           UUUUU                    C AC                G G                                A CC  CACC   A            U   ACAC   A    C           A                                  U     
Top:45|chr19_10172029|Rank:53|Level:0.136,45,chr19_10171359_10171636_AluSx_Alu_+|chr19_10172029_+|ECS:CUA,278,chr19_10171806_10172089_AluSq2_Alu_-|chr19_10172029_+|ECS:CUA,284,-422.1,0.0,G   C                          C   C                      A          U                A      C        ACGA           C       C           AUC        C       CACA              C                       A            A             U         ACCA    G C    C    C           CA      UG   C        , GGC GGGCGCGGUGGCUCAUGCCUGUAAUC CAG ACUUUGGGAGGCCAAGGCGGGC GAUCACUUGA GUCAGGAGUUUGAGAC AGCCUG UCAACAUG    AAACCC GUCU UACUAAA AUACAAAAAAA   AGCC GGU GUGGUGG    UGCCUGUAAUCCCA CUACUCGGGAGGCUGAGGCAGGA AAUCACUUGAAC C GGGAGGUGGAG UUGCAGUGA    AGAU G GCCA UGCA UCCAGCCUGGG  ACAGAG  GGA         , CCG CCCGCGCCACCGAGUGUGGACAUUAG GUC UGAAACCCUCCGGUUCCGUCCG CU*GUGGACU CAGUCCUCAAGCUCUG UCGGAC AGUUGUAC    UUUGGG CAGA AUGAUUU UAUGUUUUUUU   UCGG CCA CACCACC    ACGGACAUUAGGGU GAUGAGUCCUCUGACUCCGUCCU UUAGUGAACUUG G CCCUCCACCUC AACGUCACU    UCUA C CGGU ACGU AGGUCGGACCU  UGUUUU  UUU         ,    A                          A   U                      C          C                G      C        CAC       A    C       U           AA     U           ACCC              C                       C              A           C         CGAC    A A    A    C           AC      UU   UUUUUUUUU
Top:45|chr19_10172029|Rank:53|Level:0.136,45,chr19_10173286_10173566_AluSx_Alu_+|chr19_10172029_+|ECS:CUA,281,chr19_10171806_10172089_AluSq2_Alu_-|chr19_10172029_+|ECS:CUA,284,-395.9,0.0,  A     CAGAU  CA                  C   C                                                                 A         CA  C                       C     CA        CA                                A       C           CAGA   A            UAC                             A      UAGU    CUCCAUCUC    U     U,   UGGGC     GC  UGGCUUACGCCUGUAAUC CAG ACUUUGGGAGGCCGAGGUGGGUGGAUCAUCUGAGGUCAGGAGUUCGAGACCAGCCUGGUCAACAU GUGAAACUC  UC  UACUAAAAAUACA  AAAAUUA UCGGG  UGGUGGUG  UGCCUGUAAUCCCAGCUACUCGGGAGGCUGAG CAGGAGA UCACUUGAACC    AGG GGAGGUUGUAGU   CUGAGAU        UGCA      CCUG GUGACA    GAAA         AAAA AAAAA ,   ACCCG     CG  ACCGAGUGUGGACAUUAG GUC UGAAACCCUCCGGUUCCGUCCGCCU*GUGGACUCCAGUCCUCAAGCUCUGGUCGGACCAGUUGUA CACUUUGGG  AG  AUGAUUUUUAUGU  UUUUAAU GGUCC  ACCACCAC  ACGGACAUUAGGGUCGAUGAGUCCUCUGACUC GUCCUCU AGUGAACUUGG    UCC CCUCCAACGUCA   GACUCUA        ACGU      GGAC UACUGU    UUUU         UUUU UUUUU ,CCG            CC                  A   U                                                                 C         AC  AC             UU       C     AC        CC                                C       U           ACCC   A            CUC       ACACGGUA    CAGGUC    C      UU                   U     U
Top:45|chr19_39119416|Rank:54|Level:0.136,45,chr19_39117626_39117926_AluSz6_Alu_-|chr19_39119416_+|ECS:CUA,301,chr19_39119183_39119482_AluSp_Alu_+|chr19_39119416_+|ECS:CUA,300,-480.1,0.0,A    A    G    A         CA    C  AG    GCC                    C                     G          A      C        G              A                                         U                    C        G        UC                                    C       A                          C    A      C   G    A, UUUU UUUU UUUU UUUUUGAGA  GAGU UC  UCUU   CAGGCUGGAGUGCAGUGGCG GAUCUUGGCUUACUGCAA CU CCGCCUCCCG GUUCAA UGAUUCUC UGCCUCAGCCUCCU AGUGGCUGGGGUUACAGGCAUGUGCCAUCACG CUGGCUAA UUUUGUAUUUUUAGUAGAGA GGGGUUUU CCAUGUUG  CAGGCUGGUCUUGAAUUCCUGACCUCAGGUGAUCUG CUGCCUC GCCUCCCAAAGUGCUGGGAUUAUAGG GUGA CCACCA GCC GGCC , AAAA GAGA AAAA AAAAACUCU  CUCA AG  AGAA   GUCUGACCUCACGUUACCGU CU*GAGCCGAGUGGCGUU GA GGCGGAGGGU CAAGUU GUUAAGAG ACGGAGUCGGAGGG UCAUCGACCCUAAUGUCCGUACGCGGUGGUGC GGCCGGUU GAAACAUAAAAAUCAUCUCU CCCCAAAG GGUGCAAC  GUCCGACCAGAGCUUGAGGACUGGAGUCCGCUAGGU GGUGGAG CGGAGGGUUUCACGACCCUAAUGUCC CACU GGUGGU CGG UCGG ,A    A    A    A         AC    A  CG    AAA                    A                  A             C      C        G              C                                G                             A        A        CA                                    A       C                          A    C      A   G     
Top:45|chr19_39119416|Rank:54|Level:0.136,45,chr19_39118545_39118845_AluSz_Alu_-|chr19_39119416_+|ECS:CUA,301,chr19_39119183_39119482_AluSp_Alu_+|chr19_39119416_+|ECS:CUA,300,-476.1,0.0, C             G         CCAU  C     G GUCACC         A          CA     AA          C        G                                  A           C           A     C           U                    C        A         C                 A         A        C                           C         C        C      A  U,  UUUUUUUUUUUUU   UUUGAGA    GU UCGCU U      CAGGCUGGA UGCAGUGGCA  AUCUC  CUCACUGCAA CUCUGCCU CUGGGUUCAAGCAAUUUUCCUGUCUCAGCCUCCC GGUAGCUGGGA UACAGGCAUGC CCACC CG CCGGCUAA UUUUGUAUUUUUAGUAGAGA GGGGUUUC CCAUGUUGG CAGGCUGGUCUCGAACU CUGACCUCA GUGAUCUG CCGCCUUGGCCUUCCAAAGUGCUGGGA UACAGGUGU AGCCACCA GCCCGG CC ,  AAAAGAGAAAAAA   AAACUCU    CA AGCGA A      GUCUGACCU ACGUUACCGU  U*GAG  GAGUGGCGUU GAGGCGGA GGUCCAAGUUCGUUAAGAGGACGGAGUCGGAGGG UCAUCGACCCU AUGUCCGUACG GGUGG GC GGCCGGUU GAAACAUAAAAAUCAUCUCU CCCCAAAG GGUGCAACC GUCCGACCAGAGCUUGA GACUGGAGU CGCUAGGU GGUGGAGCCGGAGGGUUUCACGACCCU AUGUCCACA UCGGUGGU CGGGUC GG ,AA             AAA       ACCU  A     G AAAA           C          AC     CC          A        G                                  C           A           C     U  G                             A        A         A                 G         C        A                           A         C        A          
Top:45|chr19_39119416|Rank:54|Level:0.136,45,chr19_39120983_39121283_AluSc8_Alu_-|chr19_39119416_+|ECS:CUA,301,chr19_39119183_39119482_AluSp_Alu_+|chr19_39119416_+|ECS:CUA,300,-469.6,0.0, A   A                         C    G  GUCGCC           U        CA     A           C                                      A               UC        CA         A          UU                   C A      A       A C    A         U                   GC        A       C                   U          C        A,  UUU UUUUUUUUUUUUUUUGAGAUGGAGU UCGC CU      CAGGCUGGAGU CAGUGGCA  AUCUC GCUCACUGCAA CUCUGCCUCCUGGGUUCAAGUGAUUCUUCUGCCUCAGC UCCCGAGUAGCUGGG  UGCAGGCA  UGCCACCAC CCUGGCUAAU  UUUGUAUUUUUAGUAGAGA G GGUUUC CCAUGUU G CGGG UGGUCUCGA CUCCUGACCUCA  CGAUC   CCGUCUC GCCUCCC AAGUGCUGGGAUUACAGGU UGAGCCACCA GCCCAGCC ,  AAA GAGAAAAAAAAAAAACUCUACCUCA AGCG GA      GUCUGACCUCA GUUACCGU  U*GAG CGAGUGGCGUU GAGGCGGAGGGUCCAAGUUCGUUAAGAGGACGGAGUCG AGGGCUCAUCGACCC  AUGUCCGU  GCGGUGGUG GGGCCGGUUG  AAACAUAAAAAUCAUCUCU C CCAAAG GGUGCAA C GUCC ACCAGAGCU GAGGACUGGAGU  GCUAG   GGUGGAG CGGAGGG UUCACGACCCUAAUGUCCA ACUCGGUGGU CGGGUCGG ,AA   A                         A    A  AAAA             C        AC     C           A                                      G               UA        AC         C                               A C      A       C A    G         U            CC     GUA       C       U                   C          A         
Top:45|chr19_39119416|Rank:54|Level:0.136,45,chr19_39121313_39121616_AluSp_Alu_-|chr19_39119416_+|ECS:CUA,304,chr19_39119183_39119482_AluSp_Alu_+|chr19_39119416_+|ECS:CUA,300,-502.6,0.0,G      G    G    G        CA   CC  C    GUCGCC   U     A                         A   C    A                                      C                  A                U            A           UCA                                     C                C       A                          CA                   G, UUUUUU UUUU UUUU UUUUGAGA  GAG  UC CUCU      CAG CUGGA UGCAAUGGUGUGAUCUCGGCUCACC CAA CUCC UCUCCUGGGUUCAAGCGAUUCUCCUGCUUCAGCCUCCU AGUAGUUGGGAUUACAGG AUGUGCCACCACGCCC GCUAAUUUUGUA UUUUAGUAGAG   GGGUUUCUCCAUGUUGGUCAGGCUGGUCUCGAACUCC GACCUCAGGUGAUCCG CCGCCUC GCCUCCCAAAGUGCUGGGAUUACAGG  UGAGCCACUGUGCCUGGCU , AAAAAA AGAA AAAA AAAACUCU  CUC  AG GAGA      GUC GACCU ACGUUACCGUACU*GAGCCGAGUGG GUU GAGG GGAGGGUCCAAGUUCGUUAAGAGGACGGAGUCGGAGGG UCAUCGACCCUAAUGUCC UACGCGGUGGUGCGGG CGGUUGAAACAU AAAAUCAUCUC   CCCAAAGAGGUGCAACCAGUCCGACCAGAGCUUGAGG CUGGAGUCCGCUAGGU GGUGGAG CGGAGGGUUUCACGACCCUAAUGUCC  ACUCGGUGGUACGGGUCGG ,       G    A    A        AC   AA  C    AAAA     U     C                         C   A    C                                      C                  G                C            A           UAC                                     A                A       C                          AC                    
Top:45|chr12_49747723|Rank:55|Level:0.136,45,chr12_49745398_49745730_AluSx3_Alu_+|chr12_49747723_+|ECS:CUA,333,chr12_49747489_49747783_AluSc_Alu_-|chr12_49747723_+|ECS:CUA,295,-484.8,0.0,G       C                     C  A                              C           U         GCAG            A                A              A       A  A           CA                                        CACC        A                          UCACGCCACUGCAC           CA  A       A    C     A               A   AAAACUGCUUGCAG    CAU     A, GGCUGGG GUGGUGGCUCAUGCCUGUAAU CC GCACUUUGGGAGGCCGAGGCGGGCAGAUCA GAGGUCAGGAG UCGAGACCA    CCUGGCCAAUAU GUGAAACUUCGUCUCU CUAAAAAUACAAAA AUUAGCC GG GUGGUGGCAGG  CCUGUAGUCCCAGCUACUUGGGAGGCUGAGGCAGGAGAAU    UGAACCUG GAGGCGGAGGUUGCAGUGAGCCGAGA              UCCAGCCUGGG  AC AGAGUGA ACUC GUCUC AAAAAAAAAAAAAGA AGA              GGGA   GAGAA , CCGGUCC CACCACCGAGUACGGACAUUA GG CGUGAAACCCUCCGGUUCCGUCCGUCU*GU CUCCAGUUCUC AGCUCUGGU    GGACCGGUUGUA CACUUUGGGGUAGAGA GAUUUUUAUGUUUU UAAUCGG CC CACCACCGUCC  GGACAUUAGGGUCGAUGAGCUCUCCGAUUCCGUCCUCUUA    ACUUGGGU CUCCGUCUCCAACGUCACUCGGUUCU              AGGUCGGACCC  UG UCUCGUU UGAG UAGAG UUUUUUUUUUUUUCU UCU              CUCU   CUCUU ,        A                     A  C                              A           U         A               C                C                      C  G           AC                                        ACGA        C                                                   AC          C    A     G               C                              
Top:45|chr12_49747723|Rank:55|Level:0.136,45,chr12_49746010_49746318_AluSx_Alu_+|chr12_49747723_+|ECS:CUA,309,chr12_49747489_49747783_AluSc_Alu_-|chr12_49747723_+|ECS:CUA,295,-410.6,0.0,A  AG    GCAUA        C         C  AA          A           A      CCUU          U  A      G        ACCA                     A              C      A C A        CA         C        G                   A   CA                            CAACUGAGAUU      CU CACUGUAC           C        U            A    UU   U   U              , GC  CAGG     GUGGCUUA GCCUGUAAU CC  CACUUUGGGA GCUGAGGUGGG GGAUCA    AGGUCAGGAG UC AGACCA CCUGGCCA    ACAUGGUGAAACCCCAUCUCU CUAAAAAUACAAAA UUAGCC G C UGGUGGCA  UGCCUGUAG CCCAGCUA UCGGGAGGCUGAGGCAGGA AAU  CUUGAGCCUGGGAGGUGGAGGUUGCAGU           GAGCCA  G        UCCAGCCUGGG GGCAGAGC AGAUUCUGUCUC AAAA  AAA AAA               , CG  GUCC     CACCGAGU CGGACAUUA GG  GUGAAACCCU CGGUUCCGUCC UCU*GU    UCCAGUUCUC AG UCUGGU GGACCGGU    UGUACCACUUUGGGGUAGAGA GAUUUUUAUGUUUU AAUCGG C G ACCACCGU  ACGGACAUU GGGUCGAU AGCUCUCCGAUUCCGUCCU UUA  GAACUUGGGUCCUCCGUCUCCAACGUCA           CUCGGU  U        AGGUCGGACCC CUGUCUCG UCUGAGAUAGAG UUUU  UUU UUU               ,C        ACAC         A         A  CC          C           G      AC            U  C      A                                 C              U      C C C        CC         A        G                   C   AC                                             UC                    A        U            G    UU   U   CUCUCUCUCUCUCUU
Top:45|chr12_49747723|Rank:55|Level:0.136,45,chr12_49747151_49747464_AluJb_Alu_+|chr12_49747723_+|ECS:UUA,314,chr12_49747489_49747783_AluSc_Alu_-|chr12_49747723_+|ECS:UUA,295,-350.1,0.0, A     CA     C   U     A    C  A         CAA           A     GCU    CC      U  AAC    G     G        CA             A A              G    A     U         GC                 A             AUU        CA          AA         C               UCGUACCACUACAC         A      C        AGC       A    UAU     UAAAUAAAUAAAU    U    A        ,  CCAGG  UGGUG CUC UGCCU UAAU CU GCACUUUGG   GCCAAGGCAGG AGAUU   UGAG  CAGGAG UC   ACCA CCUGG CAACAUGG  AAACUCCAUCUCU C AAAAGUACAAAAAU AGCC GGUGU GUGG  GGU  GCCUGUAGUCCCAGCUA    GGAGGCUGAG   GGGAGGAU  CUUGAACCCA  AGGUGGAGG UGCAGUGAGCUGAGA              UCCAGCCUG GUGACA AGU  GAC   CUGUCUC AAAA   AAAAA             AAAG G GA         ,  GGUCC  ACCAC GAG ACGGA AUUA GG CGUGAAACC   CGGUUCCGUCC UCU*G   ACUC  GUUCUC AG   UGGU GGACC GUUGUACC  UUUGGGGUAGAGA G UUUUUAUGUUUUUA UCGG CCGCA CACC  CCA  CGGACAUUAGGGUCGAU    UCUCCGAUUC   UCCUCUUA  GAACUUGGGU  UCCGUCUCC ACGUCACUCGGUUCU              AGGUCGGAC CACUGU UCG  CUG   GAUAGAG UUUU   UUUUU             UUUC C CU         ,CC     AC     C   U     C    A  C         CUC           G     U      CA      U  CUC    A     G        AC             C A              A    C     C    GU                      GAGC          CG         AC          CC         A                                      C      C   UU   A         G    U                        U U  CUCUCUCUU
