site,top,ecs,ecs_len,es,es_len,mfe,pvalue,ecs_unpair,ecs_pair,es_pair,es_unpair
Top:61|chr7_102185867|Rank:87|Level:0.100,61,chr7_102187104_102187447_AluSx_Alu_-|chr7_102185867_-|ECS:CCA,344,chr7_102185804_102186114_AluSx_Alu_+|chr7_102185867_-|ECS:CCA,311,-464.6,0.0,A               C                           A        CA         C    A                            CA   U                    A    U        C   G                C     C        C            A  G       A      AC     A    CA  A    C                                            CC         ACUCAAAUUAAUUAA  AAAU              CA     G   UCCUGCCUGGGU      G, GGCUGGGUGCAGUGG UCACACCUGUAAUCCCAGCACUUUGGG GGCCGAGG  GGUGGAUCA CUGA GUCAGGAGUUUGAGACCAGCCUGGCCAA  UGG GAAACCCUGUCUUUACUAAA AUAC AAAGUUGG CAG CGUGGUGGCGUGUGCC GUAAU UCAGCUAC UGGGAGGUUGAG CA GAGAAUC C UGGA  CCCAG   GG  GA GCUG AGUGAGCUGAGAUUGUGCCACUGCACUCCAGCCUGGGUGACAGA  GAGACUCCA               UU    UUAAAAAAAAAAGG  AAGAG GAG            ACAGGA , CCGGCCCGCGUCACC AGUGUGGACAUUAGGGUCGUGAAACCC CCGGUUCC  CCGCCUAGU GACU CAGUCUUCAAACUCUGGUCGGACUGGUU  ACC UUUUGGGGCAGAGAUGAUUU UAUG UUUUAAUC GUC GCACCACCGUGCGCGG CAUUA GGUCGAUG GCCCUCCAACUC GU UUCUUAG G ACCU  GGGUC   CC  CU CGGC UCACUCGGCUCUAGUGUGGUGACGUGAGGUCGGACCCACUGUUU  CUCUGAGGU               AG    AAUUUUUUUUUUCU  UUCUU UUU            UGUUUU ,                A                           A        AC         *    C                            AC   U                    C             A   A                A     A        A            C  G       C A           CUA  C   C    A                                            CA                                            UG     G   U                  
Top:61|chr3_50000731|Rank:88|Level:0.100,61,chr3_49999070_49999251_AluSx4_Alu_+|chr3_50000731_+|ECS:AUA,182,chr3_50000663_50000845_AluSx_Alu_-|chr3_50000731_+|ECS:AUA,183,-267.9,0.0,A      CAA                   A                                        A         C       G      A  G           C      A         G             C              C    U        AAA   A     U      , AAAAUA   AAAUUAGCCGGGCAUGGUG CGCGUGCCUGUAGUCCCAGCUACUCGGGAGGCUGAGGCAG AGAAUCGCU GAAC CG GGAGGC GA GUUGUGGUGGG UGAGAU GUGCCACUG ACUCCAGCCUGGG GACAGAGAGAGAUU UGUC UUAAAAAA   AAA AAGUA       , UUUUAU   UUUAAUCGGUCCGUAUCAC GUGCGCGGACAUUAGGGUCGAUGAGUCUUCCGACUCCGUC UCUUAGUGA CUUG GC CCUCCG CU CAACGUCAUUC GUUCU* CGUGGUGAC UGAGGUCGGACCC CUGUCUCUCUCUGA ACAG AGUUUUUU   UUU UUUAU       ,       UAC                   C                                        C         A    U         C  A           A      G         G             U                            G     G     UUAUUUU
Top:61|chr3_50000731|Rank:88|Level:0.100,61,chr3_49999709_49999890_AluYc_Alu_+|chr3_50000731_+|ECS:CUA,182,chr3_50000663_50000845_AluSx_Alu_-|chr3_50000731_+|ECS:CUA,183,-258.8,0.0,A      CAAA                      G                                                      C                A    C       A    UU                C       C      CCA          AAA   G   A   A    A, AAAAUA    AAAUUAGCUAGGCGUGGUGGCG GCGCCUGUAGUCCUAGCUACUCGGGAGGCUGAGGCAGGAGAAUUGCUUGAAC C GGAGGU      UGCA UGGG UGAGAUC UGCC  UGCACUCCAGCCUGGG GACAGAG GAGACU   UCUCAAAAAA   AAA AAA GAA GAAA , UUUUAU    UUUAAUCGGUCCGUAUCACCGU CGCGGACAUUAGGGUCGAUGAGUCUUCCGACUCCGUCCUCUUAGUGAACUUG G CCUCCG      ACGU AUUC GUUCU*G GUGG  ACGUGAGGUCGGACCC CUGUCUC CUCUGA   AGAGUUUUUU   UUU UUU UUU UUUU ,       UAC                       G                                                    U C      CCUACA    C    A       C    UG                U       U      AC           G     G   A   A     
Top:61|chr3_50000731|Rank:88|Level:0.100,61,chr3_50000384_50000557_AluY_Alu_+|chr3_50000731_+|ECS:CUA,174,chr3_50000663_50000845_AluSx_Alu_-|chr3_50000731_+|ECS:CUA,183,-278.1,0.0,            C                     U                              A          G UG     C           GC          C                              C        A     C           CAA       A   A    A,             UAGCCGGGCGUGGUGGCG GC GCCUGUAGUCCCAGCUACUCGGGAGGCUGA GCAGGAGAAU G  UGAAC UGGGAGGCGGA  UUGCAGUGAG CGAGAUCGUGCCACUGCACUCCAGCUUGGG GACAGAGG AGACU UGUCUCAAAAA   AAACAAA AAA AAAA ,             AUCGGUCCGUAUCACCGU CG CGGACAUUAGGGUCGAUGAGUCUUCCGACU CGUCCUCUUA U  ACUUG GCCCUCCGCCU  AACGUCAUUC GUUCU*GCGUGGUGACGUGAGGUCGGACCC CUGUCUCU UCUGA ACAGAGUUUUU   UUUGUUU UUU UUUU ,UUUUAUUACUUUA                  G                                 C          G GA     U           AC          A                              U        C                 UG        A   A     
Top:61|chr3_50000731|Rank:88|Level:0.100,61,chr3_50002939_50003131_AluY_Alu_+|chr3_50000731_+|ECS:CUA,193,chr3_50000663_50000845_AluSx_Alu_-|chr3_50000731_+|ECS:CUA,183,-271.4,0.0,A      CAAAA                  A   G                 CC       A                G  G     C           GC          C   U                          C       C      CC           AAAAAAAAGAA     UC    C    , AAAAUA     AAAUUAGCUGGGCGUGGU GCG GCGCCUGUAGUCCCAGC  CUUGGGA GCUGAGGCAGGAGAAU GC UGAAC CGGGAGGCGGA  UUGCAGUGAG CAA AUCGCGCCACUGCACUCCAGCCUGGG GACAGAG GAGACU  GUCUCAAAAAA           GAACA  UAAA     , UUUUAU     UUUAAUCGGUCCGUAUCA CGU CGCGGACAUUAGGGUCG  GAGUCUU CGACUCCGUCCUCUUA UG ACUUG GCCCUCCGCCU  AACGUCAUUC GUU U*GCGUGGUGACGUGAGGUCGGACCC CUGUCUC CUCUGA  CAGAGUUUUUU           UUUGU  AUUU     ,       UAC                    C   G                 AU       C                G  A     U           AC          A   C                          U       U      A            G               UU    AUUUU
Top:61|chr14_35496778|Rank:89|Level:0.100,61,chr14_35495426_35495739_AluJb_Alu_-|chr14_35496778_+|ECS:GUA,314,chr14_35496682_35496981_AluSg4_Alu_+|chr14_35496778_+|ECS:GUA,300,-383.8,0.0,G        GU             CA      C   G               GGGCUGA      A    A     A                 G        A C     C   C    AA   GA                 A  C     AC  AU           G       GCUUUU      U     U                C    G   C        A        U     G   AA  A   A  C      C   A   GA               AA     CC    UC   CA  C , UUUGUUUU   UUUGUUUUGAGA  GGGUCU GCU UGUCACCCAGGCUGG       AGUGCA UGGC UGAUC UGGCUCACUGCAGCCUU ACCUCCCA G UCAAG GAU CUCC  UCU  GGCC CCCAAGUAGCUG GA UACAG  GC  GCUAUCACACU AGCUAAU      UUUUGU UUUUU GUAGAGACAGGGUUUC CCAU UUG CCAGGCUG UCUUGAAC CCUGG CUC  GU AUC GC UACCUU GCC CCU  AGUGCUGGGAUUACA  UGUGA  CACC  ACC  GG  , AAAUAAAA   AAAUAAAACUCU  CUCAGA CGA ACAGUGGGUCCGAUC       UCACGU ACCG ACUAG GCCGAGUGACGUUGGAG UGGAGGGU C AGUUC UUA GAGG  GGA  UCGG GGGUUCAUCGAC CU AUGUC  CG  CGGUGGUGUGG UCGAUUA      AAAACA AAAAA CAUCUCUGUCCCAAAG GGU* AAC GGUCCGAC AGAGUUUG GGACU GAG  CA UGG UG GUGGAG CGG GGG  UCACGACCCUAAUGU  ACACU  GUGG  UGG  CC  ,A        AAU            AC      A   G                            C    C     A                 G        C A     A   A    AC   G     A            C  A     CA  GG           G                   U     U                U    G   C        C        U     G       C   G  A      U   A   UC               CC     CU    CA   A   AG
Top:61|chr14_35496778|Rank:89|Level:0.100,61,chr14_35496233_35496532_AluSz_Alu_-|chr14_35496778_+|ECS:GCA,300,chr14_35496682_35496981_AluSg4_Alu_+|chr14_35496778_+|ECS:GCA,300,-459.4,0.0,U    U      U   C  C     CA                             A        C       A                        A      CAA                                C      C  G              A     UUA         G                       CG                     U         AA         CA                     A         U      C    ACA   A    , UUUU UUUUUU UUU UU UGAGA  GAGUCUUGCUCUGUCGCCCAGGCUGGAGU CAGUGGUG GAUCUUG UUCACUGCAACCUCCGCCUCCCGG UUCAAG      UUCUGCCUCAGUCUCCUGAGUAGCUGGGA UACAGG GU UGCCACCAUGUCUG CUAAU   UUUUGUAUU UUAGUGGAGACGGGGUUUCACCA  UUGGCUAGGCUGGUCUCGAAC CCUGACCUC  GUGAUCUGC  GCCUCGGCCUCCCAGAGUGCU GGAUUAUAG UGUGAG CACC   GCC     , AAAA AAAAAA AAA AA ACUCU  CUCAGAACGAGACAGUGGGUCCGAUCUCA GUCACCGC CUAGAGC GAGUGACGUUGGAGGUGGAGGGUC AAGUUC      AGGACGGAGUCGGAGGGUUCAUCGACCCU AUGUCC CG GCGGUGGUGUGGGU GAUUA   AAAACAUAA AAUCAUCUCUGUCCCAAAGUGGU  AACCGGUCCGACCAGAGUUUG GGACUGGAG  CACUGGGUG  UGGAGUCGGAGGGUCUCACGA CCUAAUGUC ACACUC GUGG   UGG     ,     U      U   U  A     AC                             C        A       C                        C      AUUAAG                             A      A  G              C                 A                       *G                     U                    AG                     C         C      U    CA    ACCAG
Top:61|chr6_13789586|Rank:90|Level:0.100,61,chr6_13788099_13788414_AluSx_Alu_-|chr6_13789586_-|ECS:UUA,316,chr6_13789353_13789645_AluSg_Alu_+|chr6_13789586_-|ECS:UUA,293,-451.4,0.0,U                       A        GC                  A  CA      CU                      A            AC     G      G            G          CA          CACACC                              A     A      A                                       AC  C   AACGAG    G     AGACGAGAUCUGCC GG      CA                   U   U   U , GCUGGGUGCGGUGGCUCAUGCCU UAAUCCCA  ACUUUGGGAGGCCAAGGC GG  GAUCAC  GAGGUCAGGAGUUGGAGACCAG CUGGCCAACAUG  GAAAU CUC UC CUACUAAAAAUA AAAAAUUAGC  GGCGUGGUGG      CCUGUAAUCCUAGCUACUCGGGAGGCUGAG CAGGA AAUUGC UGAACCUGGGAGGCAGAGGUUGCAGUGAGCAGAGAUUAC  CA UGC      ACUC GGCCC              U  GCGACA  GUGAGACUCUGUCUCAAAA AAA AAA  , CGGUCCGCGUCGCCGAGUGCGGA AUUAGGGU  UGAAACCCUCUGGUUCCG CC  UUAGUG  CUCCAGUCCUCAAUCUCUGGUC GACCGGUUGUAC  CUUUG GAG AG GAUGAUUUUUAU UUUUUAAUCG  CCGCACCACC      GGACAUUAGGGUCGAUGAGUCCUCUGACUC GUCCU UUAGCG ACUUGGGUCCUCCGUCUCCAACGUCACUCGUCUCU*GUG  GU ACG      UGAG UCGGG              A  CGCUGU  CGCUCUGAGGCAGAGUUUU UUU UUU  ,C                       C        GA                  C  AC                              G            CA         U  A            G          AC          ACCCGU                              C     C      A                                       CU  U             G                            CA                   U   U   UU
Top:61|chr6_13789586|Rank:90|Level:0.100,61,chr6_13790698_13790985_AluSx1_Alu_-|chr6_13789586_-|ECS:CUA,288,chr6_13789353_13789645_AluSg_Alu_+|chr6_13789586_-|ECS:CUA,293,-482.9,0.0,U                    A            GC                  A          CU             C                   C         C               AU     C    G              C                                A                                  C           C         U  C             GG  A    A                             A, GGCUGGGUGCGGUGGCUCAC CCUGUAAUUCCA  ACUUUGGGAGGCUGAGGC GGUGGAUUAC  GAGGUCAGGAGUU GAGACCAGCCUGGCCAACA GGUGAAACC CGUCUCUACUAAAAA  UAAAA AUUA GC GGGCGUGGUGG GGGCGCCUGUAGUCCCAGCUACUCGGGAGGCU AGGUG           UGAACCUGGGAGGCGGAG UUGUAGUGAGC GAGAUCACG CA UGCACUCCAGCCU  GC ACAG GCGAGACUCCGUCUCAAAAAAAAAAAAAA , CCGGUCCGCGUCGCCGAGUG GGACAUUAGGGU  UGAAACCCUCUGGUUCCG CCACUUAGUG  CUCCAGUCCUCAA CUCUGGUCGGACCGGUUGU CCACUUUGG GUAGAGAUGAUUUUU  GUUUU UAAU CG CCCGCACCACC CCCGUGGACAUUAGGGUCGAUGAGUCCUCUGA UCCGU           ACUUGGGUCCUCCGUCUC AACGUCACUCG CUCU*GUGC GU ACGUGAGGUCGGG  CG UGUC CGCUCUGAGGCAGAGUUUUUUUUUUUUUU ,                     C            GA                  C                         U                   A         A               AU             A           A                                C     CCUCUUAGCGA                  C           U         U  U             A   C    A                              
Top:61|chr19_970265|Rank:91|Level:0.100,61,chr19_969683_969989_AluSx_Alu_-|chr19_970265_+|ECS:CUA,307,chr19_970034_970341_AluSg_Alu_+|chr19_970265_+|ECS:CUA,308,-458.8,0.0,    A     G                      G        CC      CACC             A     A        A             G                                       CC            C  C     UGUGU            A         UUUU            UA      A                C                         CAG             C             G               CA   A     C C    A  ,     UAGUU    UUUUUUUUUUCUUUUGAGA GGAGUCUU  CUCUGU    CAGGCUGGAGUGC GUGGC CGAUCUUG CUCACUGCAACCU UGCCUCCUGGGUUCGAGCGAUUCUCCUGCCUCAGCCUCC  AAGUAGCUGGGA UA AGGCG     CACCA CAC CC  GCUAAUUU    UUGUAUUUUUAG  GAGAUG GGUUUCACCAUGUUGG CAGGCUGGUCUUGGACUCUUGACCU   GUGAUCCGCCUGC UCGGCCUCCCAAA UGCUGGGAUUACAGG  UGA CC AC G GCCC   ,     AUUAA    AAAAAAAGAAGGAGACUCU CUUCAGAA  GAGGUA    GUCCGACCUCACG CACCG GCU*GAGC GAGUGACGUUGGA GCGGAGGGCCCAAGUUCGUUAAGAGGACGGAGUCGGAGG  UUCGUCGACCCU AU UCCGU     GUGGU GUG GG  CGAUUAAG    AACAUAAAAAUC  UUCUAC CCAAAGUGGUACAACU GUCCGACCAGAACUUGAGGACUGGA   CACUGGGUGGGUG AGUCGGAGGGUUU ACGACCCUAAUGUCC  ACU GG UG C CGGG   ,AAAAA     GAAA                   G        C       ACGU             C     C        C             A                                       A             A  A     GU        C   U  AG                        CC      C                A                         A               U             G               AC      A  A A    CCG
Top:61|chr1_156350755|Rank:92|Level:0.100,61,chr1_156350231_156350519_AluSx1_Alu_+|chr1_156350755_+|ECS:CUA,289,chr1_156350692_156350992_AluJb_Alu_-|chr1_156350755_+|ECS:CUA,301,-462.5,0.0,U   C  AU  A         A                                           CUA  G         C       AA    C             C   UUC                           C               G C     A   C         CA  A              A   A     AC             A                  A        C              G       G              A              , GGC GG  GC GUGGCUCAC CCUGUAAUCUCAGCACUUUGGGAGGCUGAGGUGGGCGGAUCAC   AG UCAGGAGUU GAGACCA  CUGG CAACAUGGUGAAA CCC   AUCUCUACUAAAAAUACAAA  AAUUA CUGGGUGUGGUGGUG G GCCUG AGU CCAGCUACU  GG GGCUGAGGCAGGAG AUC CUUGA  CUGGGAGGCAGAG UUGCAGUGAGCUGGGAUC UGCCACUG ACUCCAGCCUGGGU GUAGAGU AGACCUUGUCUCAA               , CCG CC  UG CACCGAGUG GGACAUUAGGGUCGUGAAACCCUCCGGCUCCGUCCGUCUAGUG   UC AGUCCUCAA CUCUGGU  GACC GUUGUAUCACUUU GGG   UAGAGAUGGUUUUUAUGUUU  UUAAU GACCCGUACCAUCGU U CGGAC UCA GGUCGAUGA  CC CCGACUCCGUCCUC UAG GAACU  GACCCUCCGUCUC AACGUCACUCGACUCU*G ACGGUGAU UGAGGUCGGACCCG CGUCUCG UCUGGGAUAGAGUU               ,    A  CG  C         C                                           AAC  G         A       CG    U             A                          CC     C               G A     A   A         AC  C              C   C     CU             C                  C        A              A       G              AUUAUUAUUAUUAUU
Top:62|chr19_1030577|Rank:93|Level:0.095,62,chr19_1029694_1029998_AluSx1_Alu_-|chr19_1030577_+|ECS:CUA,305,chr19_1030344_1030648_AluY_Alu_+|chr19_1030577_+|ECS:CUA,305,-488.0,0.0,C   C        C  U        A        G                          A     CC                 CUC           G      A  G                     A             A         A      C                            C       A       A   G       CCA     G A           A A     C     C        C                                  A   A   C, UCU UUUUCUUU UU UUUUUUUU AGACAGAG CUCACUCUGU  UCCAGGCUGGAGUG AGUGG  CGAUCUUGGCUCACUGC   CUCUGCCUCCU GGUUCA GC AUUCUCCUGCCUCAGCCUCCC AGUAGCUGGGACU CAGGUGCCC CCACCA GCCCAGCUCA UUUUUGUA UUUUAGUA AGACGGG UUUCACC UGU GGCUAGG   GUCUC A CUCCUGACCUC G UGAUC GCCCG CUUGGCCU CCAAAGUGCUGGGAUUGUAGGUGUGAGCCACCGC CCC GCC , AGA AAAAGAAA AA AAAAAAAA UCUGUCUC GAGUGAGACA  GGGUCCGACCUCAC UCACC  GCU*GAGCCGAGUGACG   GAGGCGGAGGG CCAAGU CG UAAGAGGACGGAGUCGGAGGG UCAUCGACCCUGA GUCCGCGGG GGUGGU CGGGUCGAGU AAAAACAU AAAAUUAU UCUGCCC AAAGUGG ACA UCGGUUC   CAGAG U GAGGACUGGAG C ACUAG CGGGC GAGUCGGG GGUUUCACGACCCUAAUGUCCACACUCGGUGGCG GGG CGG ,    A        A  U        C        A          GC              G     AC                 UUC           G      C  G                     C             C         C      C          A        A        C       C       C   A       UAC     G A                   A     A        A                                  C   C    
Top:62|chr19_1030577|Rank:93|Level:0.095,62,chr19_1031619_1031917_AluSx1_Alu_-|chr19_1030577_+|ECS:CUA,299,chr19_1030344_1030648_AluY_Alu_+|chr19_1030577_+|ECS:CUA,305,-486.9,0.0,           A   U                                  A               CA                   C    A      G      A  G    C                              A      A         U        AAUU          A                  GCU  A           C       G G C      G CA             C                      C       CC         AAA   A   A,            UUU UUUUUUUUGAGGUGGAGUCUCACUCUGUUGCCCA GCUGGAGUGCAGUGG  UGAUCUCGGCUCACUGCAA CUCC CCUCCU GGUUCA GU AUUC CCUGCCUCAGCCUCCCGAGUAGCUGGGAUU CAGGCG CUGCCACCA GCCCGGCU    UUUUUUGUAU UUUAGUAGAGAUGGGGUU   CC UGUUGGCCAGG UGGUCUU A C CUUGAC U  CGUGAUCUGCCUG CUCGGCCUUCCAAAGUGCUGGG UUACAGG  UGAGCCACC   CCC GCC ,            AAA AAAAAAAACUCUGUCUCAGAGUGAGACAGCGGGU CGACCUCACGUCACC  GCU*GAGCCGAGUGACGUU GAGG GGAGGG CCAAGU CG UAAG GGACGGAGUCGGAGGGCUCAUCGACCCUGA GUCCGC GGCGGUGGU CGGGUCGA    AAAAAACAUA AAAUUAUCUCUGCCCCAA   GG ACAAUCGGUUC ACCAGAG U G GGACUG A  GCACUAGACGGGC GAGUCGGGAGGUUUCACGACCC AAUGUCC  ACUCGGUGG   GGG CGG ,AGAAAAAAGAAA   U                                  C               AC                   C    C      G      C  G    A                              C      G         C        GU            A                  AGU  C           U       G A A      G                A                      U       AC         CGC   C    
Top:62|chr6_159186301|Rank:94|Level:0.095,62,chr6_159185938_159186244_AluJb_Alu_+|chr6_159186301_+|ECS:CUA,307,chr6_159186248_159186533_AluSc_Alu_-|chr6_159186301_+|ECS:CUA,286,-346.4,0.0,U G          AA   C C              A              CA    A   CU      C    A  UG        GC  A         A    U                   A  CAA       U  A           A  C                   CA        AAC                    A     UU   GC           CC    A   A                 GCCAAAGUAAGACCC  UCUCAAG        GGGAGUCACA         GU     G   , G UGGGCAUGGU  CUC C CCUGUAAUCCCAGC ACUUUGGGAGGCUG  GUGG UGG    UGAG UCAG AG  UGAGAUCA  CC GG CAACAU   GA ACCCUGUCU  AC AAAAA AC   AAAAUUA CC GGUGUGGUGGU CA ACCUGUAGUCCCAGUUACU  GGAGGCUG   CGGGAGGAUU    GAGCCC GGAGG  GAG  UGCAGUAAGCC  GAUC UGC ACUGUGCUCCAGCCUGG               UG       GCGGGGGG          GCUUCG CU  GAGAA    , C GCCCGUGUCA  GAG G GGACAUUAGGGUCG UGAAACCCUCCGGC  CACC GCC    GCUC AGUC UC  GCUCUGGU  GG CC GUUGUA   CU UGGGGUAGA  UG UUUUU UG   UUUUAAU GG CCACACCACCA GU UGGAUAUUAGGGUCGAUGA  CCUCCGAC   GUCCUCUUAA    CUUGGG CCUCC  CUC  ACGUCGUUCGG  CU*G ACG UGACGUGAGGUCGGACC               AC       UGCCCCUC          UGAGGC GA  UUUUU    ,  G          CC   U U                             UC    A   UAGU    C    C  UA        A   A  G      CCA  U         AA  A     A  C         C  A           C  A                   AC        CCC          CGAU      C     GC   GA           UU    C   G                                                                 A  GU     AUUU
Top:62|chrX_77160093|Rank:95|Level:0.095,62,chrX_77158688_77158988_AluSc8_Alu_-|chrX_77160093_+|ECS:CUA,301,chrX_77159866_77160166_AluSx1_Alu_+|chrX_77160093_+|ECS:CUA,301,-520.3,0.0,  A                              GG         C                                                              G    A                                           C    U   G          A                       C                   UAG   GGUCUU                              UU                                                ,   UUUUUUU    UUUUUUUUUUUUUUGAGAC  AGUCUUGCU UGUUGCCCAGGCUGGAGUGCAGUGGCGCGAUCUCGGCUCACUGCAACCUCUGCCUCCU  GG UUCA GUGAUUCUCCUGUCUCAGCCUCCCAGGUAGC GGGAUUACAGG GCCC CCA UACGCCUGGC GAUUUUUGUAUUUUUAGUAGAGA GGGGUUUCACCAUGUUAGU   GCU      GAACUCCUGACCUCAGGUGAUCCGCCCGCC  GGUUUCCCAAAGUGCUAGGAUUACAGGUGUGAGCCACUGUGCCCAG  ,   AAAAAAA    GAAAAAAAAAAAAACUCUG  UCAGAGCGA AUAGCGGGUCCGAUCUCAUGUCACCGUGCU*GAGUUGAGUGACGUUGGAGGUGGGGGA  UU AAGU CGCUAAGAGGACGGAGUCGGAGGGUUCAUCG CCCUGAUGUCC CGGG GGU GUGCGGGCCG UUAAAAACAUAAAAAUCAUCUCU CCCCAAAGUGGUACGAUCA   UGG      UUUGAGGACUGGAGUCCACUAGGUGGGCGG  CCGGAGGGUUUCACGAUCCUGAUGUCCGCACUCGGUGGUACGGGUC  ,AAA       CUCU                              A                                                          GG  G    C                               A           A    U   G          A                       A                                                             UC                                              GG
Top:62|chrX_77160093|Rank:95|Level:0.095,62,chrX_77158688_77158991_AluSx1_Alu_-|chrX_77160093_+|ECS:CUA,304,chrX_77159866_77160166_AluSx1_Alu_+|chrX_77160093_+|ECS:CUA,301,-528.0,0.0,  A                              GG         C                                                              G    A                                           C    U   G          A                       C                   UAG   GGUCUU                              UU                                                U,   UUUUUUU    UUUUUUUUUUUUUUGAGAC  AGUCUUGCU UGUUGCCCAGGCUGGAGUGCAGUGGCGCGAUCUCGGCUCACUGCAACCUCUGCCUCCU  GG UUCA GUGAUUCUCCUGUCUCAGCCUCCCAGGUAGC GGGAUUACAGG GCCC CCA UACGCCUGGC GAUUUUUGUAUUUUUAGUAGAGA GGGGUUUCACCAUGUUAGU   GCU      GAACUCCUGACCUCAGGUGAUCCGCCCGCC  GGUUUCCCAAAGUGCUAGGAUUACAGGUGUGAGCCACUGUGCCCAGCC ,   AAAAAAA    GAAAAAAAAAAAAACUCUG  UCAGAGCGA AUAGCGGGUCCGAUCUCAUGUCACCGUGCU*GAGUUGAGUGACGUUGGAGGUGGGGGA  UU AAGU CGCUAAGAGGACGGAGUCGGAGGGUUCAUCG CCCUGAUGUCC CGGG GGU GUGCGGGCCG UUAAAAACAUAAAAAUCAUCUCU CCCCAAAGUGGUACGAUCA   UGG      UUUGAGGACUGGAGUCCACUAGGUGGGCGG  CCGGAGGGUUUCACGAUCCUGAUGUCCGCACUCGGUGGUACGGGUCGG ,AAA       CUCU                              A                                                          GG  G    C                               A           A    U   G          A                       A                                                             UC                                                 
Top:62|chrX_77160093|Rank:95|Level:0.095,62,chrX_77159410_77159729_AluY_Alu_-|chrX_77160093_+|ECS:CUA,320,chrX_77159866_77160166_AluSx1_Alu_+|chrX_77160093_+|ECS:CUA,301,-515.7,0.0,U           UUUU UUUUUUG                     AA       C                                  U           A               G    C  C  C                                                            U                                               AUGGUCUCGAU                        A  UC                         A            GC        C, UUUUUUUUUUG    G       UUUUUUUUUUUUUUGAGAUGG  UCUUGCU UGUCGCCCAGGCUGGAGUGCAGUGGCGCGAUCUC GCUCACUGCAA CUCCGCCUC  CCGG UUCA GC AU CUCCUGCCUCAGCCUUCCGAGUAGCUGGGACUACAGGUGCCCACCACCAUGCCCGGCUAA UUUUUGUAUUUUUAGUAGAGAUGGGGUUUCACCGUGUUA  GCCAGG           CUCCUGACCUC  GUGAUCCACCC CC  GGCCUCCCAAAGUGCUGGGAUUACA GCGUGAGCCACU  GCCCGGCC , AAAAAAAAAAC    C       GAAAAAAAAAAAAACUCUGUC  AGAGCGA AUAGCGGGUCCGAUCUCAUGUCACCGUGCU*GAG UGAGUGACGUU GAGGUGGGG  GGUU AAGU CG UA GAGGACGGAGUCGGAGGGUUCAUCGACCCUGAUGUCCACGGGUGGUGGUGCGGGCCGAUU AAAAACAUAAAAAUCAUCUCUACCCCAAAGUGGUACGAU  UGGUUU           GAGGACUGGAG  CACUAGGUGGG GG  CCGGAGGGUUUCACGAUCCUGAUGU CGCACUCGGUGG  CGGGUCGG ,            U    U                                    A                                  U           G         GA    G    C  C  A                                                                                                    CA                            UC           C  UC                         C            UA         
Top:62|chrX_77160093|Rank:95|Level:0.095,62,chrX_77161153_77161447_AluSg_Alu_-|chrX_77160093_+|ECS:CUA,295,chrX_77159866_77160166_AluSx1_Alu_+|chrX_77160093_+|ECS:CUA,301,-501.8,0.0,            A                    GG      A  C                A    A                                        G    A                                              A        G                               C                   CAG   GGUCUC                           A  UU                                               A,             AUUUUUUUUUUUUUUGAGAC  AGUCUC CU UGUUGCCCAGGCUGGA UGCA UGGCGUGAUCUCGGCUC CUGCAACCUCCGCCUC  CCGG UUCA GCGAUUCUCCUGUCUCAGCCUUCCAAGUAGCUGGGAUUACAGGUGC CGCCACCA GCCCGGCUAAUUUUUGUAUUUUUAGUAGAGA GGGGUUUCACCAUGUUGGU   GCU      GAGCUCCUGAUCUC  GUGAUCCACCC CC  GGUCUCCCAAAGUGCUGGGAUUACAGGUGUGAGCCACCGUGCCCGGC ,             UGAAAAAAAAAAAAACUCUG  UCAGAG GA AUAGCGGGUCCGAUCU AUGU ACCGUGCU*GAGUUGAG GACGUUGGAGGUGGGG  GGUU AAGU CGCUAAGAGGACGGAGUCGGAGGGUUCAUCGACCCUGAUGUCCACG GUGGUGGU CGGGCCGAUUAAAAACAUAAAAAUCAUCUCU CCCCAAAGUGGUACGAUCA   UGG      UUUGAGGACUGGAG  CACUAGGUGGG GG  CCGGAGGGUUUCACGAUCCUGAUGUCCGCACUCGGUGGUACGGGUCG ,AAAAAAAAAACUC                            C  A                C    C                 U                GA    G    C                                              G        G                               A                                             UC           C  UC                                               G
Top:62|chrX_77160093|Rank:95|Level:0.095,62,chrX_77161153_77161447_AluSx_Alu_-|chrX_77160093_+|ECS:CUA,295,chrX_77159866_77160166_AluSx1_Alu_+|chrX_77160093_+|ECS:CUA,301,-501.8,0.0,            A                    GG      A  C                A    A                                        G    A                                              A        G                               C                   CAG   GGUCUC                           A  UU                                               A,             AUUUUUUUUUUUUUUGAGAC  AGUCUC CU UGUUGCCCAGGCUGGA UGCA UGGCGUGAUCUCGGCUC CUGCAACCUCCGCCUC  CCGG UUCA GCGAUUCUCCUGUCUCAGCCUUCCAAGUAGCUGGGAUUACAGGUGC CGCCACCA GCCCGGCUAAUUUUUGUAUUUUUAGUAGAGA GGGGUUUCACCAUGUUGGU   GCU      GAGCUCCUGAUCUC  GUGAUCCACCC CC  GGUCUCCCAAAGUGCUGGGAUUACAGGUGUGAGCCACCGUGCCCGGC ,             UGAAAAAAAAAAAAACUCUG  UCAGAG GA AUAGCGGGUCCGAUCU AUGU ACCGUGCU*GAGUUGAG GACGUUGGAGGUGGGG  GGUU AAGU CGCUAAGAGGACGGAGUCGGAGGGUUCAUCGACCCUGAUGUCCACG GUGGUGGU CGGGCCGAUUAAAAACAUAAAAAUCAUCUCU CCCCAAAGUGGUACGAUCA   UGG      UUUGAGGACUGGAG  CACUAGGUGGG GG  CCGGAGGGUUUCACGAUCCUGAUGUCCGCACUCGGUGGUACGGGUCG ,AAAAAAAAAACUC                            C  A                C    C                 U                GA    G    C                                              G        G                               A                                             UC           C  UC                                               G
